name,host_is_superhost
Bright Modern Home in La Condesa,f
Cuarto para mujer tranquila . Just a woman.,f
Duplex con terraza en la Juarez,f
Depto Privado JUAREZ CONDESA ROMA REFORMA,f
Suites Casa Pánuco - Best Location Monarca,f
"Lavanda Suite Polanco, the stay that you deserve!",f
Roma Norte / La Condesa Chac's Place,f
"Great Suite best Location Reforma w/bath, Jalisco",f
Precioso departamento,f
Apartamento en Ángel de la Independencia,f
Suite Condesa Mexico Park,f
Hermosa casa porfiriana en el corazón de la Roma,f
Apartment in new polanco,f
"⚡AMAZING Views, TOP Location & TWO bedrooms",f
Dormitorio en lindo departamento,f
Bonito departamento en el corazón de la Narvarte.,f
Great Apartment in La Condesa,f
Casa Azuela,f
1 Bed Suite near to the Frida Kahlo Museum - 203,f
"Departamento 2 recámaras sobre Masaryk, Polanco",f
Departamento confortable,f
Zona Lindavista  Habitación Privada  Wifi.,f
3 story apartment in the heart of La Roma,f
"Neurologia,Pediatria,Q-504, Perisur,Cancerologia.",f
Unique Art Deco space in the heart of Roma Norte,f
Private room with terrace in Polanco,f
Chic Apartment Loft in the heart of Mexico City,f
10mins from SANTA FE MEXICO CITY/ in CUAJIMALPA,f
Rento cuarto en Unidad Villa Centroamérica.,f
Excelente habitación en inmejorable ubicación,f
Large family loft with modern decor on Reforma,f
Hab. Priv. Excelente Ubicación/Desayuno Incluido,f
P4 reforma,f
"Loft Centro Medico, Parque Delta 1 - Sanitizado",f
Cama para mochileros,f
Tonala Room  (habitación y baño privado),f
Colorida Habitación compartida en Ciudad de México,f
Recamara trasera con baño privado en penthouse,f
Bohemian and cozy apt near Cineteca in Coyoacán,f
"Bonito, cómodo y bien ubicado depto en cdmx",f
Depto Coapa Coyoacan,f
Habitación privada en la Roma. Increíble ubicación,f
Habitación en el Centro Histórico - Bellas Artes,f
"Habitación Condesa, Roma, Polanco",f
Habitación independiente en departamento espacioso,f
Comfortable and practical apartment near Narvarte,f
ELEGANT 1 BED/1 BATH ON AMSTERDAM AV.,f
Fantastic smart site 5 min from main sites in CDMX,f
Confortable habitación para una o dos personas,f
Cinnamon Loft/Your best choice in Polanco!,f
Bonito loft amueblado,f
Acogedora habitación a 5 min de centro histórico,f
Hermosa vista panorámica en Polanco.,f
"Nice, cozy home in a safe area. Close to Santa Fe.",f
Condominio toscano,f
ROOM -30% CDMX SISIVITOUR *5,f
Bonito cuarto privado con baño completo en Condesa,f
"Bonito departamento , céntrico, en punto ¨DF¨",f
Florida San Angel Coyoacan   Zona segura Mexico,f
Cálido cercano a Polanco Mariano Escobedo y Marina,f
"8* Cómoda Habitación,súper ubicada.Cerca UNAM,ITAM",f
ROOM -30% CDMX SISIVITOUR *M*,f
Welcome to the Palm House!! 5,f
"Posh and modern, the friendly",f
Cozy triple room in colonial house - Hip.Condesa,f
Comodo departamento en Capital Park en la Condesa,f
SANITIZED Downtown Beauty 1 BD ⭐️ ⭐️ ⭐️ ⭐️ ⭐️,f
Hermoso Departamento a 8 min del WTC,f
Departamento Galerias Insurgentes,f
Entire flat in Roma/Condesa,f
HABITACIÓN con  internet EXCELENTE UBICACIÓN,f
Small apartment in Chapultepec,f
Lujoso departamento de 120 mts en condominio vip,f
Habitación 5 Amueblada Con Servicios Incluidos,f
Big cozy Mexican-style bedroom (private),f
Confortable room - Roma Norte CDMX,f
Departamento recién remodelado a un paso del WTC,f
Nice bedroom in beautiful house at La Condesa - 2,f
"Depa tranqui cerca del aeropuerto T1,T2 y foro sol",f
Two Story 2BR apartment in Roma Sur,f
Nice and Clean Room at Atlampa,f
21_Departamento remodelado en la Condesa,f
Selina Mexico City Downtown - Standard Room,f
Cuarto/Private room @ Lomas d Chapultepec/Polanco,f
"La casita de Frida Bellucci Coyoacán, Suite",f
A las Puertas del Bosque 8 (Piso 3),f
Vive La Roma.,f
Lindo departamento cercano a la Central de Abasto,f
"Vista Mágica #4 Comodidad, Privacidad y Seguridad.",f
Excellent private room with bathroom,f
Departamento muy iluminado y centrico,f
Perfect Loft great Location,f
Beautiful 2 bedroom perfect Location,f
"CONFORT@ 04: Studio ROOFGARDEN, zona WTC y Condesa",f
SANITIZED High End Industrial Design Heart Condesa,f
HERMOSO Y ACOGEDOR DEPARTAMENTO EN LA ROMA NORTE,f
Apartamento fuente de Cibeles / Roma Norte ! :),f
Habitación privada,f
Perfect Location Reforma,f
quite place in coyoacan centre.,f
Lovely and cozy furnished studio. Great location.,f
Habitacion con Excelente Ubicacion Roma 17,f
Habitación/cocina compartida frente Estadio Azteca,f
"Beautiful Suite, half a block from Masaryk St.",f
"DEPA. ENTERO, A 5 MINUTOS DE SANTA FE, INTERLOMAS",f
Luxury apartment in the best area of Condesa,f
Cozy MiniRoom w/TV for 1 person (5m2/bed1.7mX0.8m),f
Best Location in Mexico/Cozy room/Bibiroom,f
Loft Colonia Del Valle,f
Bello loft con jacuzzi en el San Jerónimo Lidice,f
"NEW, full, sunny, cozy, @ CONDESA",f
Tiny Rooftop Home @ UNAM,f
Prvte Rm Patio 2 Queen beds Condesa,f
Penthouse. One Block from Reforma W/Terrace,f
Luxurious studio apt in La Condesa apartament 2308,f
Luxury and great location apartment 2506,f
Great and cheap ap 1202,f
Casa completa sur de la ciudad.,f
Habitación Gratitud en Casa Tanimisha Santa fe,f
Roma awesome apartment,f
"NewSuite with King Size Bed&Sofa, the Perfect Rest",f
New and great location in Condesa ap 1307,f
Suite familiar amplia y cómoda,f
Suite económica e independiente,f
Two story apartment in Roma Sur,f
Quiet & Comfy double bedroom - excellent location,f
"Room near Reforma and Polanco, Xilitla",f
"Private room near Zona Rosa and Reforma, Los Cabos",f
Private bedroom in amazing house - best location,f
Full Apartment BEST LOCATION (Near Angel/Reforma),f
Private Single Room with bath #1 @YumaGuestHouse,f
Depto Privado JUAREZ CONDESA ROMA REFORMA,f
Prehispanic style appartment,f
BEST LOCATION! walk everywhere 3 BR CONDESA ROMA n,f
"Col. Roma,  Cozy loft in the heart of Mexico city",f
"ENSENADA  25, CONDESA",f
Private apartment 15 min to downtown,f
NICE +BIG ROOM/ GREAT APARTMENT/ AMAZING LOCATION,f
"Solomonoff apart brigth, beautiful & confortable",f
"Double Room, best location!",f
"Historical Loft best location, Turín",f
"Suite 1 Reforma Angel, excelente ubicacion",f
La mejor habitación en el centro de la ciudad. B18,f
Cozy studio with 2 rooms in Condesa,f
Best option in Reforma/ Hotel amenities,f
BEST location EVER: Roma / Reforma!! !!,f
Modern room in vibrant area full of nightlife,f
Vilma apartament,f
"Great Apt! good for families and groups, COL ROMA",f
Habitación privada Arte Déco con áreas comunes,f
Ciudad de México Tlatelolco cerca centro histórico,f
CENTRO HISTÓRICO HABITACIÓN CON BAÑO,f
Habitación vista Viaducto,f
Cuarto Grande y Sencillo para pasar la noche,f
Increíble loft estilo jungla urbana,f
Increíble habitación privada en la colonia Roma,f
Azomalli,f
Bonito Departamento en el corazón de la Narvarte,f
Departamento de diseño en la Condesa,f
Monte Albán Narvarte Poniente,f
Loft near downtown with kitchen and bathroom,f
Hermoso Penthouse con terraza privada,f
Linda recamara cerca de parque de los venados,f
SANITIZED Roma Norte Infinity Pool Rooftop ⭐⭐⭐⭐⭐,f
"Apartment (201) Two Bedrooms (3) Beds, Roma",f
SU HABITACIÓN EN EL CENTRO HISTÓRICO.  BAÑO PROPIO,f
"Best Location in Mexico city, Really nice Flat",f
"Nice apartment 3 blocks from reform 222, 2 bedroom",f
Suite en excelente zona sur de la CDMX,f
Moderno Cuarto Amueblado Escandon (condesa)1,f
Breezy and delightful on a trendy location,f
Beautiful apartment in the down town,f
Loft Contemporáneo a 50m del Centro de Coyoacán,f
RUSTIK COMFORT CDMX DOWN TOWN (CENTRO) HOUSE,f
"Departamento estilo mexicano, cerca centro Cdmx",f
Perfect Loft great Location,f
Downtown Mexico City - Puerta Alameda Suites,f
Luxury apartments in Roma/Condesa,f
Tony Location - HISTORIC CENTER REFORMA SECURE 105,f
QUIET 2 Qn beds prvte bthrm Condesa,f
Great Private Room for TWO w/Bath!,f
Olivos Duplex Loft w/terrace and great view! 2BDRM,f
Departamento Desierto de los Leones 15 mi Santa fe,f
"Habitación  ""Perseverancia"" en Santa Fe",f
Hermosa Habitación en Coyoacán con baño propio,f
"Depto lindo, cómodo, comunicado",f
"Best HOUSE @Best Street of CONDESA ""CASA TURQUESA""",f
Cozy room close to ITAM/UNAM,f
"Big, sunny, two bedroom apartment in best location",f
MODERN APARTMENT IN THE BEST CONDO,f
Easy going room in heart of the city.,f
Beautiful cozy apartment in Coyoacan.,f
SUITE EJECUTIVO The Gran San Antonio Abad,f
"Estadio Azteca.Baño compartido,entrada independ.",f
"Cómoda, tranquila y súper bien ubicada habitación",f
4 beds bedroom in Condesa,f
Condesa Roma WTC Suite Maximum Covd Protection,f
Departamento vintage amoblado,f
Estancia céntrica,f
Small room in the Roma Countess,f
Depa nuevo de 3 cuartos en la Roma Norte!!!,f
TU HOSPEDAJE CONFIABLE,f
The Foodie Hostel (Habitación Compartida),f
-50% Off,f
Full apartment - HOTEL AMENITIES!,f
Colorful pent house in Condesa.,f
"Península Tower SANTA FE, Mexico City",f
LONDRES 212 PENTHOUSE,f
"Bonito Departamento! 1 recamara, todos servicios",f
Cozy apartment with great location,f
Nice Private room near Reforma Diana / St Regis,f
Suites Casa Pánuco/ Best Location / Morelia,f
Habitación privada Roma 12,f
Excelente ubicación en el corazón de la CDMX,f
Suites Casa Panuco / Best location / Piel Canela,f
Amueblados aeropuerto,f
"Cuarto 5min reforma, Chapultepec, auditorio",f
"Bonito departamento, acogedor, limpio y seguro....",f
Cuarto en Condesa Amsterdam A7,f
☆ Locación estratégica en CDMX,f
Casa Amor te hace sentir el Hogar Mexicano,f
[Brand New] Modern Mexican  2bd/2ba Apt @ Roma,f
"Muy iluminado, a pie, a 15 Mins. Centro Histórico.",f
Departamento zona sur  Frente al hospital marina,f
2 beds in the heart of Condesa,f
Hermoso loft en Lindavista,f
Charming Apt. in Heart of Condesa,f
Room with excellent view and location,f
SWEETY PET WORLD II,f
ART HOUSE MEXICO,f
Solei,f
Warm studio in condo with security,f
⚡Cosmocrat Fresh & Shinny,f
Encantadora habitacion frente al WTC,f
P7 ｼ Amazing PENTHOUSE in the Heart of MEXICO CITY,f
Moderno Cuarto doble Amueblado Escandon (condesa)2,f
"Departamento en Medellin, comodidad y confort",f
"Apartamento nuevo, seguro, cerca de IPN/hospital",f
Nice bedroom in beautiful house at La Condesa - 3,f
HomFor Nápoles: Loft,f
Depa con balcón y linda vista Parques Polanco 2BR.,f
"Cosy Studio Apartment in Condesa, Mexico City",f
DOWNTOWN good location,f
"Cerca de FUCAM,  Shriner's, Angeles, escuelas",f
LA CASA DE TONA. 3er Dormitorio c/cama individual,f
Spacious pop-art loft in paseo de la reforma,f
Departamento elegante y nuevo para  relajarse,f
Beautiful vintage apartment from 1900’s,f
Departamento acogedor,f
CONDESA Cool and Relax (Room 1) con baño privado,f
Primero Sueño. ¡Bienvenidos asiáticos !,f
Cómodo y Céntrico Alojamiento en CDMX 5 huéspedes,f
¡Visita ideal.!,f
Habitación Privada,f
Habitación en Polanco carso con alberca,f
"Amplio Departamento, Roofgarden+Gym, Zona Reforma",f
SANITIZED Sophisticated 1 Bdrm Apartment 5 Stars,f
M&S departamento entero,f
P6 Apartment in Reforma / US Embassy,f
Departamento privado WTC dos recamaras,f
WTC ROOM FOR YOU,f
Agradable estudio completamente equipado,f
Beautiful 2 bedroom perfect Location,f
"C13D14.Loft with balcony, Coapa Espartaco",f
Depa Sotelo,f
Hermosa casa estilo chalet a 7mins de Santa Fe,f
"Great location, huge and beautiful apartment",f
(R) Excelente departamento al sur de la ciudad,f
Habitaciones col Del Valle centro,f
Recamara Zen  para descansar (a 5min de Santa Fe),f
Best location ever: Roma & Reforma!,f
Magnífico apartamento independiente y bien ubicado,f
Mini lofts Buenavista cerca del centro Loft 208,f
Confortable habitación en el sur de CDMX,f
El corazón de la ciudad. b12,f
Bonita recamara en centrica casa,f
SANITIZED Destination Polanco @Portika,f
Habitaciones en Renta,f
Hermosa casa en las montañas y a la vez en la cd,f
Confort a bajo costo.,f
The Foodie Hostel (Habitación Compartida),f
"Chapultepec, la mejor ubicación al mejor precio",f
Nice flat to rest in the middle of the city,f
"Excellent place to stay near Reforma,  / Quetzal",f
La mejor opción para alojarse en la Ciudad,f
Habitaciones en excelente departamento,f
"New secure studio, in a very well located area.",f
"Neurología, Inp,Q-304,UNAM, Perisur, colmex",f
HOSTAL ECOLÓGICO LA TERCIA,f
Cuarto en Depa Roma Norte,f
"NILO 33, room #2",f
Habitación cerca de Aeropuerto Benito Juárez,f
2 Beds Suite near to the Frida Kahlo Museum - 301,f
Luxury apartment in Roma with a perfect view,f
French style near Downtown / Zona Rosa / Reforma,f
"Small Tokio style loft in Polanco - 1BD, 1BA",f
Cosy Loft near Reforma,f
Habitación Compartida 14 camas a 5 min BellasArtes,f
"Lindavista - near Downtown CDMX, IPN and Cinvestav",f
"Suite Privada con cocineta y baño, ideal parejas",f
"Beautiful apartment 2BR, 7Pax @Roma Norte.",f
Depa para estrenar en el corazon de San Jeronimo,f
EL SOL — Huge Apartment in the Heart of Roma Norte,f
Alojamiento San Joaquín F,f
Nice bedroom in beautiful house at La Condesa - 8,f
Luminoso apartamento  en Condesa!!!,f
Habitación comoda y silenciosa en Roma sur,f
"HABITACIÓN EN EL CENTRO HISTÓRICO, TODO CERCA",f
Sweet and relaxing in the beautiful Roma,f
Beautiful and cozy apartment Ahuehuetes,f
Tranquilidad y excelente ubicación lo que buscas,f
"Loft/estudio cozy,súper limpio y mucha luz natural",f
PRIVATE terrace and BEST Location for FIVE guests!,f
ROOMS CDMX SISIVITOUR *3*,f
AGRADABLE Y CONFORTABLE HABITACIÓN con internet,f
Cheaper Room #1 Amazing Location Near Coyoacan!,f
Hermosa Recámara Amoblada en La Condesa.,f
Cama King - Reforma,f
Habitación privada en departamento compartido.,f
Perfect Studio in Roma amazing location,f
Studio Roma bonito neighborhood !!!!,f
Exclusiva Suite en la fuente de las Cibeles,f
Departamento céntrico saliendo del metro Mixhuca,f
Mini suites Centro Historico,f
Vista Mágica #1 Habitación con la mejor vista cdmx,f
SANITIZED Industrial Design @Arquimides Polanco,f
Polanco: 2 recámaras autónomas con baño privado,f
Perfect Loft great Location,f
The Chopo department,f
Basílica de Guadalupe.,f
Suite Ejecutiva céntrica colonia Del Valle,f
"C13D13. Private department, Coapa Espartaco",f
✯ MASTER SUITES PRIME LOCATION ✯,f
Enjoy living in Tlalpan Center-Hospitals area,f
Trendy & Comfortable Apartment - Narvarte,f
"Casa Wendy Polanco, CDMX",f
Bonito cuarto frente a parque 2,f
Depto en Polanco exelente ubicacion,f
Casa Xitle,f
LUXURY APARTMENT IN DOWN TOWN (ALAMEDA CENTRAL),f
Sofisticado y moderno loft en la Roma,f
Amplia habitación,f
Gran Departamento zona divertida! Super ubicado!,f
"New Polanco Penthouse, spectacular view 19th floor",f
Amueblados del sur,f
"Suites Deli. Best Location, Mejor Ubicación CDMX",f
Warm and welcoming room in family home,f
Suites Alameda Park,f
Habitación iluminada en la Roma A7,f
Departamento en centro de la CdMX - Bellas Artes,f
Trendy room next to coffee shops and restaurants,f
Private room with services in front of a park,f
Excelente PH + RoofTop,f
Cielito Lindo Best Location near Reforma,f
Comfy King Size Bed Bedroom in Polanco,f
2 Beds Suite near to the Frida Kahlo Museum - 101,f
Amplio departamento con super ubicación,f
Departamento D Parque Delta - Sanitizado,f
Cómoda Habitación en tlatelolco para dos personas,f
"Depto privado  frente AICM T1, 5 min CAMINANDO",f
"Amplio, silencioso y bien iluminado depa Narvarte",f
Cuarto en Condesa Amsterdam A8,f
Suite Palenque near St Regis / Reforma,f
Casa Celia Stark. Penthouse en calle Gelati. Top,f
Cozy apartment in Pedregal in quiet and safe area,f
Habitación en Colonia Del Valle muy céntrica,f
Loft super super acojedor y sin ruido,f
Casa de Irma para visitar la ciudad o de negocios,f
Nice and typical apartment at 3min Airport!,f
GREAT Apartment 2BR 5BED @Roma Norte & Condesa,f
BEAUTY COZY ROOM ZONA ROSA EMBAJADA US X;,f
Bonito Departamento Centro Ciudad De México,f
303 Depa completo Lindavista cerca de la Basílica,f
La Casa de Las Flores,f
"1121-AEROPUERTO,FORO SOL,PALACIO DE LOS DEPORTES",f
Increíble Suite Privada y Moderna Horse Sanitizada,f
Loft Privado de 2 pisos con Netflix al sur de CDMX,f
Pequeno depa en excelente ubicación,f
Mejor ubicación? Imposible!,f
Loft in Roma Norte,f
"Next to Reforma & Embassy EUA, Col. Cuauhtémoc",f
Habitación para conocer Coyoacán,f
Perfect suite in the best Location,f
Casa de lujo  minimalista para descanso,f
Cómodo Departamento Entero en la Col. Del Valle,f
Mexico City Apartment in Downtown,f
Big House @ Condesa for 30 Guest,f
CONDESA 2 Floors Studio @Amsterdam street,f
Best Location Condesa 2-room appt,f
Agradable y céntrico departamento Reforma-centro,f
"Suite Polanco, your comfort is our priority!",f
Puerta Alameda Deluxe Apartment,f
"Suite dres, a dos cuadras de la ROMA",f
Mini SUITE EN EL CORAZÓN DE LA ROMA.,f
CHARMING FULL APARTMENT IN CENTRAL MEXICO CITY!,f
Serenity room condesa Individual,f
LA CASA DE TONA. Dormitorio con cama matrimonial,f
PentHouse de gran diseño contemporáneo,f
"Trendy and cozy, perfect for families",f
Small and Confortable Loft,f
4 Bedrms 3 bathrms heart of Condesa,f
Local house with private rooms,f
"Best apartment in Mexico City! NEW, clean and safe",f
LA BUENA ESTANCIA,f
8 min walk to WTC big illuminated and comfortable,f
"Habitaciones en renta, o departamento completo.",f
Suites CasaPanuco / Best Location /Mariachi,f
Private Room / French style (shared bathroom),f
A bed in the heart of Condesa,f
Nice Flat in San Miguel Chapultepec.,f
"Vista Mágica #2 Comodidad, Privacidad y Seguridad.",f
8 ﾂﾞ Five Star Charming Home in Trendy Condesa☆,f
Tradicional y exclusivo depto a 5min Aeropuerto,f
Great Location in La Condesa/ 4bed/3bath,f
"Room in Mexico City, Coyoacan.",f
"Beautiful room, amazing view",f
"Bright, quiet, clean, centric, garden view",f
Short-Term Room w/airport shuttle,f
Beautiful and nice zone  Bedroom includes all,f
Del Valle - Heart of Mexico City,f
Comfortable and bright room enero,f
Recamara en amplia casa familiar 1,f
Coyoacan Cozy Room Pool&Gym,f
"House in Roma two floors, 3bd, rent for month!",f
Estudio con cama en casa-habitación,f
QUIET Room Perfect Location Condesa,f
lovely 1bd apt MEXICO CITY,f
Room for student near schools area,f
Bonita recámara,f
Confortable habitación,f
Maravillosa Casa Anzures!,f
Beautiful and brand new Suites! (E),f
,f
Espectacular vista en el mejor ubicación,f
Tranquil home in sweetspot of Roma,f
Charming and central apartment!,f
❤ MX - SUITES FOR WORKSHOPS & GROUP STAYS,f
Habitación con balcón!,f
Habitaciones comodas y amplias,f
COMODIDAD Y UBICACIÓN,f
Charming room in La Roma,f
Hab.  estilo campirano  cerca zona hospitales,f
Mejor que Couch Surfing!,f
Hermosa casa Coyoacan microclima especial .,f
Rento Habitación en la Narvarte en Pestalozzi,f
Departamento colonia Roma Sur,f
Tania & John,f
Clean VALUE Location Groups 3BR 8Pax Roma Condesa,f
La Casita de los Portales,f
Casa Condesa,f
Almost like home!,f
Estudio equipado,f
Departamentos en Condesa,f
APARTAMENTOS AMUEBLADOS TIPO HOTEL,f
"Recámara Belisario Domínguez, Hospitales Tlalpan",f
Impresionante loft de 2 plantas c/estacionamiento,f
Suite (habitación) in Roma Norte,f
Loft independiente con terraza,f
Your own Frida Kahlo Balcony outside the bedroom,f
"Amazing mexican place, James Bond was here",f
Condesa Private Room w/P Bathroom T @Casa Turquesa,f
Great room del valle 0%damage after the earthquake,f
Quiet and nice apartment.,f
The Vegy Room en Chapultepec,f
"Buen precio,excelente ubicación",f
La casa de LAU,f
"Habitación triple, 3 camas individuales",f
Cassa Rossa. Ladies Residence CDMX,f
Cuarto independiente con baño propio en una casa,f
Depa en la bella zona de San Pedro de los Pinos,f
Habitación en plaza Carso,f
Recamaras con baño privado en el corazón de la CD.,f
Well locaten rooms for business & visitors,f
The best location in Mexico City!!,f
Cómoda recámara con TV + baño,f
1 Habitación en renta por día o por mes,f
Habitación en la Roma,f
A private room in popular area of Roma Norte!,f
Departamento cerca de metro Tacuba,f
Habitación en Escandón/Condesa para mujeres.,f
SUITES CORPORATIVAS MONTE ATHOS 320,f
Habitación Privada con ubicación inmejorable,f
Depto atrás de televisa San Angel,f
Habitación semi privada en Roma Norte,f
HERMOSO Y GRANDE DEPARTAMENTO 5 MINS DE AEROPUERTO,f
""" LOVELY APARTMENT/AMAZING VIEW/ GREAT LOCATION """,f
Rento Recamarita Bondad en Santa Fe,f
Habitación con baño privado.,f
Vibrant Room in Historic Downtown,f
La casa de los Ángeles,f
Habitacion para dos personas en Casa Díaz,f
Nice and well located room for 2.,f
Habitación Privada en Depa Compartido_Narvarte,f
Renta de Cuartos Del. Azcapotzalco,f
Departamento retro en Mixcoac,f
"Relaxing ""OASIS"" Huge house 22 pax condesa 7BR",f
Apartamento bien ubicado bonita vista con balcón,f
Carso Alameda Deluxe Apartment,f
Tu mejor Opción 420 en la Escandón,f
Cómodo Hostal al sur de la Ciudad,f
Recamara amueblada con Servicios y baño privado,f
Culhuacán inn,f
"Cuarto de Azotea todos los servicios, Cuajimalpa!",f
Vive el SUR de la Ciudad de México II,f
"¡10 personas! 2 depas en el mismo piso, Santa Fe.",f
"Condominio Nuevo Bucareli 121, Col. Juarez",f
Habitación amueblada y con todos los servicios,f
Cozy room in Coyoacán,f
Cómoda habitación en la Condesa,f
Habitación en departamento en Condesa,f
Bohemian Safe Apt 2-Bedroom in Centro (Downtown),f
DEPARTAMENTO CERCA DE WTC amplio y tranquilo,f
Brand NEW apt! 2 BD / two BT - Insurgentes Sur!!,f
"Very near Polanco, Plaza Carso & Antara!",f
Departamento confortable,f
Habitación en Clínica muy céntrico,f
DepaR&L,f
Suite #1 Departamento 1 rec. Lomas de Chapultepec,f
"Departamento en zona sur, cerca de periférico",f
Hermosa Habitacion independiente con baño.,f
COZY LOFT APARTMENT CONDESA,f
Habitación Doble,f
The Aunts house,f
"Comfy Room, Queen Size Bed (new), 5 min to Coyocan",f
"SÓLOMUJERES recámara Coyoacán, doctoras y turistas",f
Suite in Reforma. Hotel amenities. Pool/Gym. K5,f
Habitación privada cerca de Narvarte y Coyoacán,f
"RECAMARA  EJECUTIVA, CERCA REFORMA 222 Y EL ANGEL",f
Best Location in Condesa and Mex city hot spots!,f
Departamento hanna,f
HABITACION AMPLIA 10 MINS VELODROMO y 5 AEROPUERTO,f
Exclusiva Suite de 1 recámara,f
Casa de descanso a 15 km de Coapa. (Sur CDMX),f
"Tranquila habitación Pequeña, 3er Nivel, comoda.",f
Lucerna 23,f
Departamento Delta,f
Single Outer Apartment with Full Service Included,f
Londres 212 suite de lujo Mediana King,f
Habitación Matrimonial Privada.  Zona Acoxpa,f
Acogedor departamento con excelente ubicación,f
Casa Club Leon. Cuarto 2. PA,f
"Mexico City - Condesa, Private Room 2",f
"Quiet Zone, Private garden door,  own desk",f
Habitación en Ciudad de México,f
Rento cuarto muy bonito con todos los servicios en Tlalpan apto para doctores o doctoras residentes  muy cerca de zona de hospitales a 5 minutos vigilancia 24 horas Jardín en la parte de atrás,f
"2 BDRM Historic Center, Amazing big department 226",f
Cuarto para una persona en excelente ubicacion.,f
"Habitación privada, cerca de Polanco y Zócalo",f
"Loft ""El 10""",f
Sunny Polanco Apartment (great location/amenities),f
Little Cozy Spot in Del Valle Norte (Double Room),f
SamuelGrado,f
Habitación 2/3 Depa con vista espectacular CDMX,f
Depto de lujo en la Juarez. Espectacular Vista.,f
"Recámara en la Condesa, muy buena ubicación",f
Enjoy the Best Park Views at High Design House,f
"Habitación para 1 o 2 personas, camas individuales",f
Zona de Hospitales/Belisario Domínguez,f
"Comfortable, central and quiet, near to condesa",f
UIC UNIV INTERCONTINENTAL,f
Cuarto independiente con excelente ubicación,f
Excelente habitación al sur de la ciudad,f
Quédate conmigo,f
Comfortable and relaxing apartment in good area,f
Habitación Yureli,f
Habitación tipo loft,f
"La Condesa, chic & trendy",f
Van Gogh  -  Amazing 1 bedroom apt in Polanco,f
Sunny & huge apartment in Condesa - great area !,f
Hermoso departamento muy ubicado en Roma norte,f
Departamento a 5 minutos de plaza carso,f
Private room with terrace in Polanco,f
HARMONIOUS Loft  in Polanco with terrace!,f
HAB. TULUM,f
CHACAHUA,f
"Chic room, in condesa",f
Pensado pa ra todo viajero,f
Cozy Apartment in Roma hood,f
Jtowers Hotel Boutique,f
"Cool, cozy and colorful apartment in Condesa",f
Casa Libia recámara matrimonial + recámara literas,f
"Acogedor departamento frente a UNAM, Av IMÁN,",f
La Luna (Habitación para una o dos personas),f
Stunning Apt. Heart of Plaza Carso/Antara/Polanco,f
Una  Nueva Experencia .,f
"Habitación en departamento espacioso, sur de CDMX",f
GALILEO HIGH-END Spacious Apartment,f
Departamento con excelente ubicación en Polanco,f
CONDOMINIO JADE NUEVO BONITO SOLEADO,f
Boho Chic Roma,f
Sweety Pet World,f
luxury appartment for rent in San Jeronimo CDMX.,f
Pequeño Depa en el Centro Histórico,f
Confortable and luminous bedroom in El Roble,f
"SUR DE CDMX, ITESM, UAM, UVM, ZONA DE HOSPITALES",f
Vespa Flat,f
Spacious and neat bedroom in Coyoacán.,f
Departamento de Lujo Del Valle (metro División),f
Fantastic room in ROMA NORTE!,f
Habitación céntrica,f
Recamara en San Pedro de los Pinos - Gayfriendly,f
CONFORT BEDROOMwi-fi,f
Confort y seguridad,f
Amplia habitación en Narvarte - Lo de Timón,f
Acogedora habitacion privada al sur CDMX,f
Suite doble privada y espaciosa,f
Recamara independiente a 10 min de Santa Fe.,f
