name,host_is_superhost
Habitacion doble cama a 5 min EXPO WTC,t
"Aeropuerto,foro sol. Lujoso departamento completo",t
Confortable y amplio departamento en el Centro,t
Habitación cómoda en el corazón de CDMX -2,t
"⚡ AMAZING apartment, great location ⚡ 331",t
Descubre un lugar luminoso  cerca de la diversión,t
Room in chic Mexican apartment Roma Norte,t
Hermoso departamento en la mejor calle de Condesa,t
LOFT CLOSE TO BELLAS ARTES,t
Apartment in Mexico’s City Downtown  (CENTRO),t
Coqueto loft independiente en súper ubicación.,t
"Depa MUYcerca Santa Fe, HospABC Tec y oficinas!",t
BIG CENTRIC HOUSE Near Everything to Explore CDMX,t
Modern & Quiet Apartment w/deck @DelValle near WTC,t
Condesa terrace bedroom in private house with pool,t
La mejor experiencia de alojamiento,t
"Dream house in Polanco area, BBQ, Roof top, garden",t
Dpto. Portales Oriente,t
Pequeña y acogedora mini suite N°15,t
THE POLANCO HOUSE  inmejorable ubicacion y precio,t
DEPARTAMENTO amueblado pequeño con estacionamiento,t
La Casa del Mimo-Habitación Mimo Trova,t
"5 min de Aeropuerto, Foro Sol, Palacio de Deportes",t
Colorful and Artsy 3BR 2BA Apt in Roma Norte,t
“El Colonial”. Excelente ubicación. Amplio espacio,t
Cómodo departamento.,t
"Habitación en PB, 2 camas individuales.",t
Departamento en el corazon de la Condesa,t
Hands down! Best Location in Polanco with Terrace,t
*Availabe* Cozy apartment at Condesa Center,t
FUNCIONAL Habitación para trabajo o descanso.,t
Casa cerca de UAM Xochimilco y canal de Chalco,t
"Hogar a 5 min UPN, ASF, SIX, FLAGSO, Hosp. Ángeles",t
"Cerca al WTC, cama individual.",t
Foro sol & Palacio 5 mins walking!! Airport,t
Hotel Botique in the best part of La Condesa,t
Cozy modern apartment in the heart of Condesa-Roma,t
Suite Privada in Roma Norte,t
Steps away from Reforma Av with private roofgarden,t
"Gorgeous Suite alongside Masaryk, Polanco.",t
NOW OPEN POOL★PRIVATE ROOFTOP&GRILL★3FLOOR★CONDESA,t
"Depa Legaria, cerca de Polanco",t
Art Deco Building /PH/Balcony/Best Location,t
Alojamiento con baño privado en **REFORMA**,t
Loft con la mejor ubicación de la ciudad,t
HABITACION ROMITA,t
Cálida y hermosa suite céntrica para 2 (A1),t
"A 600m de la Embajada USA, con balcón, remodelado.",t
Frida's Coyoacan,t
"Luxury apartment best zone, cool room",t
HOSTAL CASA COYOACAN,t
"New Building  in la Roma, 2 Brd",t
Superb Suite few steps away Masaryk.,t
"Cozy, Minimalist Spacious Fully Equipped Apartment",t
1 AMAZING & SUPER WELL LOCATED REFORMA/ANGEL,t
Cómoda  y amplia habitación en excelente ubicación,t
"✨Magic, healing  Apartment Luna✨",t
Dormitorio en Roma Sur,t
Cool Loft en el centro de LA CONDESA,t
Departamento confortable y muy agradable!,t
Cómoda recamara a unas calles barranca del muerto,t
Encantadora posada para estancia confortable,t
One of the best views of the city guaranteed!,t
Nueva Suite B Minimalista,t
⚡️Discount *Casa Alameda* Downtown CDMX Condo,t
Suite King size a 10 min. del WTC y del HIP (1),t
Cómoda Habitación privada a uno pasos del WTC (8),t
Preciosa y moderna habitación privada en Polanco,t
Moderno depa en el centro de la CDMX,t
"En el ♥️ de la Roma, Limpieza desinfectante",t
"""Miyana"" 2/Room Depto a 600m del Hospital Español.",t
"Lovely Apartment - Roma, Condes, WTC",t
Departamento Nuevo de Lujo en vecindario céntrico,t
"The ""home"" feeling in Mexico City!",t
WONDERFUL ROOM IN COYOACAN HOUSE,t
"CONDESA COZY, COMFORTABLE APARTMENT",t
Business Suite BEIGE near Reforma,t
Apartment 3 blocks from Bellas Arte,t
Radiant Apartment with Terrace in Roma Norte (1/4),t
Beautiful sunny loft in Del Valle,t
Fancy Furnished Apartment & Great Location,t
"Sunny, Peaceful & Beauty  Apt / 2rooms 1.5 baths",t
nice apartment in colonia del Valle,t
2 bedroom Designers PH w/Roof garden,t
Charming Apt in the best location,t
Beautiful Room for 2 with p/Bathroom - Roma,t
BRIGHT & MODERN TWO LEVEL PENTHOUSE,t
En el corazón de la escandón,t
1BR Studio in the heart of Coyoacan,t
Cozy Apt / Best Deal in Escandon,t
"Super nice room in Coyoacan, 5 minutes UNAM",t
In the heart of Polanco,t
Great apartment in Condesa + Pool + Parking,t
"SAN ANGEL / SAN ANGEL INN, picturesque area (1).",t
Mini loft at great location,t
GREAT PLACE AND LOCATION @POLANCO,t
Best Location. La Roma & Condesa.,t
Pequeño departamento con vista a Bellas Artes,t
Lovely Room Downtown,t
Cozy Penthouse in Roma Norte,t
Great room & fantastic location in POLANCO!,t
Luxury & Bright Heart of Polanco Business & Family,t
Great Walking-distance Neighborhood,t
Industrial Inspired Rustic Loft Apartment,t
"Private, Clean & Cozy Suite - WiFi",t
L'OliveGorgeous studio. 5minWTC. Clean&Desinfected,t
There's no best Location in CONDESA!!!,t
#505 Deluxe  A/C apt.❤️of the city!!,t
#504 Cozy & A/C apartment downtown!,t
"Super cool, fancy and relaxed apt. in best zone",t
Cozy suite in Santa Fe área,t
Hermosa casita en la Colonia Roma,t
"1st , Private Room Condesa - Roma",t
3rd Fl. Private Condesa - Roma,t
Cosy little house,t
Nova House,t
BEAUTIFUL APARTMENT IN ROMA NORTE,t
REFORMA - Brand new 3BR @ Rio Danubio,t
Vast serviced apartment in elegant neighbour,t
"Fully equipped apartment, Colonia Del Valle",t
"The Palms, Col Roma, Mexico´s heart",t
Beautiful room in Condesa !,t
Modern apartment near Reforma,t
PRIVATE 50% OFF Cosy Design Apartment in Roma!,t
Trendy Business-Quality Flat!,t
Estudio en el corazón de Condesa,t
"2 Bedroom Terrace Apt Downtown, Airport & Concerts",t
Great Loft Location,t
Cozy centric apartment,t
Chic Minimalist Apartment in Roma,t
Cozy apartment w/ patio in la Roma!,t
Bright 2BD in Roma Norte,t
Penthouse  in trendy Roma Norte with terrace,t
Condesa 2 Bedrooms 2 Baths  Free Parking & Balcony,t
Alojamiento en ciudad de Mexico,t
Fashion Neighborhood / PRIVATE ROOF GARDEN,t
In front of the Palaces- Amazing view_RoofGarden.,t
Departamento,t
Peach Forest Department,t
Departamento cerca de interlomas,t
Nice & Cozy Room in Condesa,t
Loft Gym & Pool - 15Mbps WiFi ✔,t
Beautiful Apt. Condesa Building,t
NICE CLEAN ILUMMINATED LOCATED,t
Luxury apartment in Santa Fe area,t
Casa mexicana en la colonia Roma,t
"Casa RM26 Room 8 at Roma Norte, CDMX",t
"Casa RM26 Room 10 at Roma Norte, CDMX",t
Luxury Apartment in Letran Valle,t
"Casa RM26 Room 9 at Roma Norte, CDMX",t
⚡50% OFF! LACONDESA New Apt- Top Location,t
Hermoso apartamento en Condesa 202,t
Cuarto independiente - Roma Norte,t
Colonial meets modern in the center of Mexico City,t
stylish new  and secure apartment,t
Cozy room with bay window and balcony,t
Bello y luminoso loft en Coyoacán,t
"Amazing Location Patio Apartment • La Roma, Mexico",t
Perfect Place for Executives Working in Santa Fe,t
Edificio Glorieta 469,t
"Habitación iluminada, espacio amigable al ambiente",t
(5)Full Apartment in Colonia Roma BIS,t
Polanco prime location apartment,t
"Casa Donceles Plus Apt 2❤️Groups, family, friends!",t
"Artsy, Handmade, Loft in Historic downtown",t
"Luxury in San Angel - 2BR/3BA 1 King , 2 Twin (M)",t
Sky Pool + Luxury = The Sublime,t
Residencia Lindavista 1,t
Ubicado en la emblemática colonia Roma Norte.,t
LOFT NAPOLES THE FOURTH SKY,t
Boutique Apartment Downtown 1B,t
Brand New Apartment in Plaza Carso,t
#305 Gorgeous & spacious downtown apartment,t
Mexican Artcraft. Balcony flat.,t
Beauty & tranquility in ancient heart of Mexico,t
Bedroom near to AirPort MX..,t
Stylized Luxury Apartment in Hip Roma Norte,t
Cabaña Espacio de Oyamel,t
LAREDO PB · Intimate Hideout Studio,t
"LAREDO 6 · Modern eclecticism in ""Amsterdam Road""",t
The Local Way - Mexican Groove,t
Suite #521  Sencilla- 01 Recámara 01 Baño,t
"Condesa, lovely apartment.",t
"Modern, Industrial Apartment with Bamboo Garden and Rooftop Terrace",t
"Suite-Apartamento #411, 01 Recámara, 01 Baño",t
Cómoda suite en la colonia Juárez (Junior suite5b),t
"COMODA HABITACION, ILUMINADA Y BIEN VENTILADA",t
Exclusive apartment in the heart of La Roma,t
Depa super equipado en la del Valle,t
Big & cozy private room in lovely Rooftop,t
Loft meets nature between Condesa and Roma,t
⚡50% OFF! Penthouse In Best of Condesa,t
Trendy and cozy apartment at Condesa´s heart,t
Departamento  en inmejorable ubicación.,t
Down town Private terrace Purified water,t
Espléndido departamento tipo Loft,t
Beautiful Flat in Historic Center Mexico,t
Fully Amenities 1 bedroom Polanco Area on Sale!,t
Great apartment in trendy zone,t
⚡50% OFF! CozyApt BellasArtes-Top Location,t
Townhouse de diseño,t
Stylish spacious 1940s flat in heart of Condesa,t
Nice Room 2 at Coy. w/Independent Access to street,t
REFORMA - NEW 2 BR - R. Panuco,t
Bright Penthouse with Private Rooftop : Roma Norte,t
Suite 621 - 01 Recámara-01 Baño,t
Comfortable apartment for travelers,t
Centric apartment - home away from home,t
1 habitacion de Casa en renta para un huésped,t
"Mid-City Hideout, near WTC Condesa Roma",t
Suite Loft Coapa,t
"""The blue"" room, next to Frida Kahlo's house.",t
"""Casa Ana"" ¡Cómodo y agradable departamento!",t
Like home in City Center -Chez Moi au Centre Ville,t
Hip Loft CDMX,t
Feel like home in Mexico City!,t
Incredible Department  Del Valle Centro CDMX,t
Queen bed w/ priv. bathroom in a bright flat,t
Small and Independent Rooftop Studio,t
Polanco Cozy Room,t
BIG ROOM WITH PRIVATE BAHT AND LIVING ROOM 4 PERSO,t
Executive 2BR Suite at Hotel Zone Connected to WTC,t
Cómodo y seguro cerca de Polanco,t
Cozy Apartment in Roma Norte /Great Location,t
El Estudio De Don Diego,t
Recámara con baño independiente,t
Room for 2 in Condesa,t
Departamento cerca del centro de Ciudad de México,t
Hermoso Departamento en Reforma 222,t
Authentic experience in THE HISTORIC CENTRE,t
Midcentury Townhouse in La Condesa by El Nido,t
Gray Room  near Polanco,t
Safe & Family Apartment / Polanco CDMX 3bed&2bath,t
Top located apartment rental in Mexico City,t
Chic Apartment with a Gym and Views of Forest and City,t
⚡50% OFF! Magnificent Apt-Pool-Top Location,t
"Espacio cerca al metro, descuentos a grupos",t
2 bedroom apartment,t
Very bright full apartment,t
#301 Beautiful 1 Bedroom A/C Apt. Prime Location,t
"Bello departamento, con AC y todo lo que necesitas",t
Moderno departamento frente a Alameda Central,t
Nice room & bathroom,t
Cheerful department very centric near to WTC,t
Hermosa recámara en la colonia Condesa.,t
Habitación amplia con balcón e internet veloz,t
Private bungalow in Coyoacán.,t
"Departamento en la CDMX , Cerca de Polanco",t
Apartamento en zona sur Tlalpan,t
Cálido mini loft en Col. San Rafael Cd de México,t
"Fantástica habitación nueva en la Condesa, Arévalo",t
"Casa Donceles Plus Apt 7❤️Groups, family, friends!",t
"Fantástica habitación nueva en la Condesa, Morales",t
En el corazón cultural de la Ciudad de México,t
"Avant-garde and modern space ""Eclectic Veracruz""",t
Beautiful room in the Condesa,t
Habitación privada para estudiantes IPADE #2,t
BELLA HABITACIÓN CÉNTRICA CERCANA A COYOACÁN,t
Lotería en el Centro Histórico,t
GREAT PLACE AND LOCATION@POLANCO 3,t
"Private Guest House, Tlalpan Centro",t
2 Room Apt in Narvarte Neighborhood near Mall,t
"Brand new, modern studio. Historic Downtown Mexico",t
New appartment near Santa Fe,t
Rio Rhin 64,t
36. Nuevo! Moderno Loft en pleno Centro Histórico,t
Lovely Room In Heart of La Condesa's Cafe District,t
Apartamento en el Corazón de la Condesa 204,t
Casa Q BnB,t
Great Apt. in the heart of Colonia Juárez,t
Polanco near Antara 2 Bedroom / 2.5 Bath,t
Departamento Art deco CONDESA planta baja,t
Habitación cómoda y funcional,t
Casita de la Palma Casa ecológica,t
Coyoacan's Beautiful & Quiet Roof Studio w/Terrace,t
COMFORTABLE & NICE place in NEW Polanco CD.MX,t
"La Condesa, totally renewed 2bdr apt, best area!",t
Confortable loft en Lomas de Chapultepec,t
"Col. Roma, Awesome 2bdr apt. in trendy area!",t
REFORMA - Brand new 2BR @ Atoyac 63 -5min to park,t
"La Condesa, Super Nice & Cozy 1 bedroom Apt.",t
Full Apartment in Great Location   Coyoacan CDMX,t
Urban Loft Paseo de la Reforma,t
Parque España Luxury Apartment with Balcony,t
"Depa Céntrico, luminoso con balcón cerca d Reforma",t
PORTIKA POLANCO MEXICO CITY - BEAUTIFUL APARTMENT,t
"Casa Prima, wonderful and cute apartment.",t
"Cute and ideally located, welcome to our place !",t
Apartment,t
"Bonito depa cerca Polanco, económico y con todo",t
"Habitación privada, acceso privado y baño privado.",t
Cálida habitación con baño privado en Coyoacán,t
"Comfortable room, affordable price, ideal students",t
"Reforma, Roma, Condesa, Polanco and Chapultepec.",t
Room Octavio Paz: Indoor garden,t
ANZURES PRIME LOC' HIGH END LOFT,t
UNIQUE “Tropical-INDI” Mexican Style - guestroom,t
Roma Condesa chic loft with pool,t
Cozy and convenient apartment near Santa Fe 102,t
Bright apt. in Colonia Roma: Ideal for long stays,t
"Apartamento único tipo casa, en Roma Condesa CDMX",t
Casa Real Condesa,t
Casa Lupita,t
Dolores House,t
Wide bedroom near Coyoacán subway.,t
Cdmx Top-Rated 4BR in La Condesa,t
Merlo's Suite,t
La casa del Mezcal. Cuarto de los Magueyes.,t
Savor Sweeping Urban Vistas from the Bedroom Balcony,t
Condesa BEST in Amsterdam,t
Soak in the Mezzanine Bath at an Industrial Juárez Home,t
Hermoso Departamento en Paseo de la Reforma,t
Modern loft in restore building 204,t
Bienvenid@s...!!! Welcome...!!!Sígale bien pueda.!,t
Amazing loft in Polanco,t
Comoda habitacion Naranja en la Roma,t
Happy place :),t
Junior Suite & Private Bathroom (Coyoacan Nearby),t
Centric private Room Mexico City CDMX DF narvarte,t
Recámara en San Pedro de los Pinos 2,t
Your own place on Frida’s terrace! BEST location!,t
Roof top living,t
"Río Alto, Departamento independiente",t
Excelente espacio a 70 metros de Reforma,t
Big & Comfortable Apartment in Chapultepec-Condesa,t
lindo y acogedor departamento en la roma,t
Roma Norte 2 BR apartment @ Mexico City,t
"Casa de los cactus, B",t
Comfortable room in Roma Norte,t
Habitación en el centro de la Ciudad de México,t
Hermosa Casa Colonial Mexicana Confortable.,t
Departamento céntrico y con vistas espectaculares,t
Casa Kamffer 2 small apartment,t
Excellent Apartment in the middle of Mexico City!,t
Chic Penthouse in the heart of Polanco,t
Cozy sunny new apt. near Reforma & Down Town,t
El Mejor Cuarto Privado. Mixcoac Private Room.,t
Cozy room with private terrace in Escandón,t
 Private lovely Loft at Condesa (Best area),t
Exclusivo departamento en Nuevo Polanco,t
"Casa Cardón, frente a la Roma. Singular y moderna.",t
Luxury apartment. Ideal for business trips.,t
Cozy apartment in heart of Polanco/CDMX,t
Private Micro Studio near Coyoacán,t
"Beautiful, warm and central with park view.",t
Walk to Museums from a Calm Apartment in Colonia Cuauhtémoc,t
Executive Department in the Condesa,t
Cozy studio @ the most beutiful street of Mexico,t
Depto cerca de zona de hospitales y Tlalpan centro,t
Excelente estancia en zona centro (Tlatelolco),t
Apartment Downtown 1106,t
"El Colibrí ""Little Oasis in Polanco""",t
"In Condesa; great spot, large for groups&families",t
Departamento todos los servicios (cdmx downtown 1),t
Alojamiento cercano a Aeropuerto Ciudad de México,t
Confortable y seguro mini-loft en Coyoacán,t
Bello y acogedor departamento en el sur de CdMx,t
"2bedrooms, 2baths, Terrace in High Park Santa Fe",t
Alto Polanco - Spectacular Apartment Amazing View,t
2 flats in Condesa for up to 12 people.  3rd floor,t
Condesa habitación sanitizada para 1 a 4 personas,t
Apartment Downtown 1506,t
Roma La Juarez,t
"Tropical Chic : Heart of Condesa, walk everywhere.",t
"Remodelado, a pasos de Six Flags, cerca de Colmexl",t
Vibrant 2 BR Apt on Av Reforma + Incredible View,t
Departamento con gran vista en Paseo de la Reforma,t
14.Loft (Website hidden by Airbnb) mejor ubicación.Barrio Chino,t
Bed & Bike Loft,t
Comfortable | Stylish | Studio | Colonia Roma!,t
pequeño departamento! privado!,t
AMPLIO DEPTO UBICADISIMO  FORO SOL AEROPUERTO,t
"New small & clean. Kitchen, tv,  wifi, city view.",t
Incredible apartment near Av. Reforma,t
Habitacion sencilla pero INCREIBLE.,t
"Roma Sur, dependable, roomy, great kitchen",t
Grandioso departamento en Centro de Coyoacán,t
"Departamento en Polanquito, lavadora, balcón",t
Agradable Departamento Céntrico.,t
Departamento Amueblado Centro CDMX PB  Zocalo,t
Amazing Apartment in Mexico City Historic Center,t
Cdmx Top-Rated PENTHOUSE in La Condesa,t
"DEPTO #102 ""FRENTE AL AEROPUERTO""",t
I wanna dance with somebody @ Roma Norte best area,t
Comfortable and Illuminated Apartment at Condesa,t
Knocking on Heavens Door @Roma Norte w/3 Balconies,t
Private room close to the Airport and Foro Sol,t
Comoda e Iluminada Habitación,t
Small and economic room in Condesa,t
Apartment near the Hospital ABC 1403 @Santa Fe,t
Bello LOFT en La Roma frente a La Condesa,t
Apartamento Executive  WTC / Napoles,t
Betel 401 acogedor departamento,t
CDMX ★PH1★ in La Condesa,t
"Remodeled, steps from Six Flags! English spoken",t
GUEST HOUSE*sharing with a graphic design studio,t
AWESOME apt in Polanco!! SUPER LOCATION// 2BR,t
"Steps Away From Parks, Cafes, Bars & Restaurants",t
PORTIKA POLANCO precioso departamento (7 personas),t
Roof Suite San Angel con terraza,t
Best location @Condesa. Monthly  special rate 5⭐,t
"¡La mejor casa para hospedarse!, Six Flags, Ajusco",t
Private rooftop & the best location,t
RESIDENCE LAS TROJES CDMX,t
Depa a todo dar muy a gusto !!,t
BEST LOCATION EVER,t
Newly renovated executive apartment!! 2BR,t
Casa del Mezcal. Cuarto  de los Venados.,t
"Acogedor, lindo; cerca de metro, parque y bosque.",t
Habitación acogedora y bien ubicada,t
Offer Cool and cozzy apartment downtown Mexicocity,t
"Haz de este totalmente nuevo departamento en la Condesa, tu casa en CDMX",t
Recámara en King Size San Pedro de los Pinos,t
Heart of the city-spacious-Wash/dry-full equipped,t
Agradable loft muy bien ubicado,t
⭐Roma Norte Full Apartment with roof garden,t
Rincón Romántico,t
CONDESA SUITES,t
Departamento en la mejor ubicación de la Roma,t
Departamento cerca de San Ángel,t
CONDESA SUITES,t
"50% Off Best Hotel Suite, Location & View in SF",t
Departamento sur CDMX cerca de Centro Médico Naval,t
Double bed bedroom  unique location (WTC),t
Depto Amueblado Nápoles World Trade Center WTC,t
Depto Amueblado Nápoles World Trade Center  WTC,t
Depto Amueblado Nápoles World Trade Center WTC,t
"Departamento frente a Tlatelolco, CDMX",t
Depa para 6 personas a 2 calles de la Condesa,t
Studio apartment close to airport (t1) & concerts,t
"Casa Kamffer 3, the studio full apartment",t
LA CASA DE JESUS  EN COYOACAN Habitacion IX de 15,t
"Aeropuerto (MEX) , ForoSol ,Tapo, Downtown, CDMX.",t
HISTORICAL CENTER APPARTMENT,t
Yolotli Calli - En el Corazón de la CDMX,t
Xochimilco,t
Depto Amueblado Nápoles World Trade Center WTC,t
Cozy apt in Santa Fe near the business district,t
☼Modern new room @ Polanco!! corner w/Masaryk av.☼,t
Departamento en Xochimilco para 4 personas,t
"*Breakfast included, 20 minutes from downtown CDMX",t
"Luxurious Bedroom w/ TV (WTC, Condesa, Roma)",t
Condesa TOP location/Beautiful Townhouse/Terrace,t
Hermoso y céntrico Penthouse.,t
Cueva de lobos,t
WTC Exclusive Condo - City View Double Room,t
Recamara Amueblada Nápoles World Trade Center,t
"Nice and comfortable room, San Angel PH",t
Spacious room in the heart of Condesa,t
"GREAT Flat, you will want to stay longer!!",t
Unit 1 Family Air Conditioning 2BR/2BA in Condesa,t
Linda y confortable Casa en la mejor Zona de la Cd,t
L'Olive Lovely Garden House / 10 min to WTC,t
Habitación privada a 25 minutos de Bellas Artes.,t
Departamento Vancouver Near the Airport!,t
Habitacion 2 en complejo residencial.,t
Recamara individual 7,t
Recámara con todos lo servicios 6,t
Departamentos nuevos con alberca climatizada !!!!!,t
Cozy 100% refurb Studio. Unbeatable location.,t
Modern Mexican Loft in the heart of the city,t
Casa del feliz No.3,t
Recámara con baño privado 4,t
"Casa completa, Pet Friendly carretera  Cuernavaca",t
La casa de María. Habitación zafiro para huéspedes,t
Airport Apartment!! Depto.Frente al Aeropuerto!!,t
"Condesa, Departamento privado, trabajo o turismo",t
In Front Airport!!    Depto. Frente al Aeropuerto!,t
Santa Fe apartment! Best Location&Comfort&Security,t
"Friendly Historic Artsy Room, Bellas Artes",t
"TOWNHOUSE, ROMA CONDESA WTC, ROOF GARDEN, 3B 3BATH",t
Residencia Lindavista 3,t
"Habitacion con baño privado, cerca wtc, tranquila",t
Habitación Agave Azul en La Casa Azul - Sur CDMX,t
México Chulo - Apartment 301,t
Discover an Award-Winning Apartment in La Roma Norte,t
Beautiful and cozy suite with balcony,t
Cozy apart with patio in trendy La Roma,t
Depto San Pedro de los Pinos,t
Acogedora habitación en departamento muy céntrico,t
Casa de Gloria,t
"Renta lugar cómodo, céntrico. Por día, o semana",t
"Safe Apartament with security 24hrs, near WTC.",t
Relax with Some Foosball at a Colorful Pad with City Vistas,t
Departamento en Escandón,t
"Private room in front of CU, UNAM, CDMX",t
Bonito loft rústico en San Jerónimo cerca del IPPC,t
Pequeño Departamento Near the Airport (T1),t
#501 HIstoric CDMX...  3bedroom 2bathroom Apt.,t
Sweet dreams in the city,t
"Amplio, acogedor y super bien ubicado, con Roof",t
"Acogedor, confortable y bien ubicado con Roof",t
Lindo departamento cerca de estación Buenavista.,t
Filos-HouseDepartamento Completo.Centro de Tlalpan,t
"Bonito Loft Nuevo, Super Centrico y en Zona Segura",t
Guajillo Suite-Frida Kahlo’s neighborhood-Coyoacan,t
Tu hogar cerca de la villa en La Ciudad de Mexico,t
JUUB  Coyoacan at your doorstep!,t
Nice room in safe and centric apartment,t
"Bonita casa en barrio colonial, ubicadisima",t
Gorgeous new spacious apartment near downtown,t
Basílica de Guadalupe alojamiento,t
"PA126-P4, @ 4 blocks from World Trade Center!!!",t
Loft minimalista impecable. En pleno Centro Histórico.,t
Departamento Céntrico con 2 Habitaciones,t
✨New design loft near Alameda/Bellas Artes,t
"Habitación privada en casa,200mts del metro zapata",t
"Colonia Juárez, Precioso departamento de 2 recamaras con Roof Garden!!",t
Depto a 4 cuadras de la Alameda y Bellas Artes,t
Hermoso y acogedor departamento,t
Premier Apartment Downtown 5 Guests  AC,t
Lindo y confortable departamento,t
Private and luminous room in Nápoles,t
Habitación en el corazón del Centro Histórico,t
Cozy country retreat in fashionable Roma,t
Agradable departamento en ROMA SUR Ideal para CDMX,t
Nice Apartment in Mexico's Down Town,t
Edificio Remodelado. Frente al Munal. Centro Histórico,t
Spacious apt in Condesa with amazing park view,t
4BR/4BA Large House up to 18 people-Casa El Angel,t
Chic Suite in Spacious House near Coyoacán,t
Habitación en la Hipódromo Condesa,t
Casa Ezpania. Habitación ll.,t
Full apartment in Reforma,t
Boutique Apartment two bedrooms / 326,t
LOVELY PRIVATE APARTMENT 3BR 102 @Santa fe,t
RESIDENCIA LINDAVISTA 6,t
"Spacious 3 bedroom Apartment  ""La Santísima""",t
Private room in CDMX/Habitación Privada en CDMX,t
Domain Tower 12,t
Cómoda y bien ubicada recámara,t
Private Room in CDMX/Habitación Privada en CDMX(2),t
Mexico’s City Classic Suite,t
Habitación Plus Centro Histórico Seguridad 24/7.,t
"Beautiful, brand new and cosy appartment in Juarez",t
Departamento suite-parking Condesa.,t
Loft y parking. Departament Atlixco,t
Depto. Río Tiber,t
Bella recamara en Polanco,t
departamento colonial muy cerca del centro.,t
Lindo Penthouse sobre Reforma,t
Disinfected! Polanco apt. Private patio pool & gym,t
Suite Ejecutiva Del Valle ideal para parejas,t
Ubicación espacio altura comfort silencio: para ti,t
"New and modern apartment in Narvarte, Mexico City",t
Modern Apt in Best Area of Roma CDMX. All Equiptm,t
"CONDESA Roof Art Studio 1, with private bathroom.",t
"SANA DISTANCIA, depa completo, PetFriendly",t
Comfortable apartment w/ stunning view in Condesa,t
12. Modernísimo loft a pasos de la Alameda Central,t
Casa Cabrera B,t
Lovely apartment located in the heart of Condesa!!,t
"10 min walk to Antara, Plaza Carso & 15 to Polanco",t
"Loft azul, muy cerca de Todo. Super Céntrico",t
Linda habitación,t
Habitación (2) privada muy cerca de coyoacán,t
CASA MANRIQUE IS READY FOR YOU,t
DEPA TIPO LOFT EN INMEJORABLE UBICACION CONDESA,t
JUUB  Traditional Condesa Experience,t
"Central, stylish, Mexico's essence at one place",t
BRAND NEW Art Deco in the heart of Mexico City.,t
Urbanist's apt. for 4 one block away from Reforma,t
Family & Business Apart Polanco CDMX 3bed&2bath,t
Departamento Suite-Parking Atlixco.,t
Confortable departamento completo en Condesa,t
Unique 2BR Apt. Financial District / Reforma,t
Departamento PH Vasco De Quiroga,t
Pequeño y cómodo departamento en la Roma!,t
"Casa Verde In La Condesa: Fresh, Cool & Cozy",t
☆Spazzio☆ depto con cochera 15 min a Santa Fe,t
Departamento acogedor en Roma Norte,t
A perfect place in Mexico City,t
Cuarto entrada independiente privado roma valle,t
Cute apartment near downtown,t
Downtown Condesa Close to Amsterdam &Parque Mexico,t
Charming apartment at Mexico City downtown.,t
Lovely  & Independent Room near Chapultepec,t
Luxury Bohemian chic Condesa Neighborhoud,t
Perfect 2Bed 2Bath Apt in Angel/Reforma/US Embassy,t
Lindo departamento equipadísimo en zona Polanco,t
Hermoso Departamento Nuevo /Excelente ubicación,t
Departamento en Aeropuerto,t
Hermoso departamento en el corazón de la Roma!,t
"Mexico City, Centro Histórico, Alameda, Down Town",t
3 balconies BestLocation GreatView,t
