name,host_is_superhost
"EN CONDESA, lleno de encantos depa en lugar magia",f
Zacatecas #65 - 503 · Destination Condesa @Roma Norte Penthouse Loft,f
Moderno y céntrico departamento - en Puerta Jardín,f
Habitación Premium Totalmente Equipada,f
"Nuevo, 2r. con patio privado y alberca en terraza",f
Lovely  private room near subway and park,f
Yellow Downtown Depto completo,f
Quiet room in the best area of Mexico City,f
Departamento 2 recamaras Monumento a la Revolución,f
"Modern, Small and fully Equipped Apartment • 1",f
Condesa Luxury KS room w/private bathroom,f
Recámara 2 Casa Colonia Cuauhtémoc.,f
Lomas de Chapultepec 2 Bedroom Apartment  • B,f
Loft “La Doña”,f
Habitación Pantaco,f
Otoño  Perfec room near Reforma and Zona Rosa,f
Departamento entero a 10 min del Aeropuerto CDMX,f
Habitación con 2 camas con todos los servicios,f
Armonioso hogar en el corazón de la CDMX,f
¡Habitación accesible y muy bien ubicada!,f
"The best place for you, Aparment Del Valle!!!!",f
Xochimilco a tu alcance.,f
Oferta Junio LOFT  2do-21  (Hospital Siglo XXI),f
Suite 8 en Recinto Histórico,f
"DEPARTAMENTO BONITO, CÓMODO PARA TU DESCANSO",f
Luxurious Apartment with Amenities Near Santa Fe,f
"Habitación con baño privado, cómoda y agradable",f
"Casita independiente en Coyoacán, acceso a jardin",f
"Villa Alfonsina, Heart of Coyoacan",f
"Renew Room, near to Condesa",f
Chic Room in Luxury Polanco,f
Descansa en la Suite de la Abuelita San Angel CDMX,f
"Descansa en la suite del geógrafo, San Angel CDMX",f
Centric Spacious Home @ La Condesa,f
"Cómodo Estudio del Arqueólogo, San Angel CDMX",f
Big apartment Condesa México City,f
Private Room with perfect location,f
beatiful two bedroom apartment ,f
Habitación individual en casa,f
UNIQUE ♥ SPACE IN LOVELY CONDESA,f
TROPICAL LOFT,f
Elegant bedrooms in a fully equipped apartment,f
Beautiful Antique/Luxury MEX-House,f
Cozy Room in the Heart of Coyoacan,f
Unique apartment near Coyoacan.,f
"Villa Carmen, Heart of Coyoacan",f
Private room in Polanco!,f
Quiet sanctuary in the heart of  DF,f
Nice room close to museums and park,f
Ideal for Social Distancing and safe.,f
"Mexico City, Polanco Nice Apartment Two Bed/Bath",f
"BEAUTIFUL, BRIGHT, BIG & COZY IN POLANQUITO",f
Hermoso Loft en renta,f
"Descansa en la Preciosa Suite del Arquitecto en San Angel, Ciudad de México",f
Nice Room & Best Location in the City!,f
Private bedroom south of the city,f
Cuarto en Santa Fe Corporativo,f
Great room close to UNAM,f
Cuarto grande e iluminado-Coyoacan,f
Bugambilia House - Room w/bathroom,f
"IDEAL LOCATION: BUSINESS, PLEASURE AND REST",f
Amazing Deal LoftBed in a Eco-Coyoacan Casita,f
The palm house,f
Private art studio in Mexico City,f
NEW  APARTMENT IN POLANCO,f
Enjoy Holiday Season In the Heart of Mexico.,f
Suite Elbruz Departamento Ejecutivo en Polanco,f
Cuarto baño privado x Santa Fe. Tenis Gym Alberca,f
Best place in Condesa,f
"Excelente ubicacion. Nuevo, equipado y funcional",f
Cozy room in heart of Condesa,f
Apartment in an artist's house,f
Cozy Private Bedroom,f
Bonito estudio con baño y cocineta independiente.,f
"Céntrica, confortable y limpia habitación.",f
LINDA HABITACION EN COLONIA CONDESA,f
Beautiful apartment downtown Mexico,f
Santa Fe - Skyview,f
The most centered and beautiful house in Coyoacán,f
"Right by everything, feels like a small town",f
"Colonia Cuauhtemoc, Reforma, US Embassy",f
FABULOUS HISTORICAL GEM IN THE HEART OF POLANQUITO,f
Habitación linda y confortable.,f
"DESIGNER STUDIO, BEST LOCATION AT ZONA ROSA :D",f
"Corazón de la Roma sur y Condesa, beautiful room",f
"Beautiful, Secure and Widespread Apartment in Mex!",f
Brand new MODERN 2BR 2.5 BA Apartment in  Roma Sur,f
Zona Polanco  extraordinario,f
Beautiful home in the heart of Coyoacán. WELCOME!,f
(Be Grand Lomas)  cerca cc santa fe y expo bancome,f
Cozy- close to Embassies in Polanco,f
Best Apartment in Heart of La Roma,f
Bonito departamento ¡Inmejorable ubicación!,f
Céntrico departamento para visitar la Cd de México,f
Lovely and Cozy Apartment near downtown.,f
Cozy and trendy little loft @HipodromoCondesa,f
Chic Scape - Polanco Carso,f
GREAT  VIEW / MODERN APT  IN PERFECT LOCATION,f
"Condesa chic, beautiful and classic building",f
"Habitación en Penthouse,amplio e iluminado con gym",f
"DOWNTOWN MEX CITY ""CARSO ALAMEDA"" BUILD ENGLISH",f
Traditional 50's apartment near Reforma,f
Room in modern & cozy flat-Carso.Polanco.Soumaya,f
Private suite w/ bath in gorgeous Condesa casa,f
The most beautiful apartment in the best street,f
"1 habitación, excelente ubicación Del Valle",f
Luxury room / private bath near to WTC / Pepsi Ctr,f
Linares,f
Best Location in Roma / Mejor Ubicación en Roma,f
Habitación con baño privado,f
Room in large super-central apartment,f
EN CENTRO HISTÓRICO CDMX INMEJORABLE UBICACION,f
Charming apartment in Condesa,f
Modern apartment Lomas Chapultepec,f
Comfortable apartment close to the historic center,f
Medium room with  a Van Gogh picture.,f
Recámara en excelente ubicación.,f
Great Apartmen at Nuevo Polanco,f
Big Penthouse and perfect terrace in Polanco!,f
Beautiful and cozy apartment downtown Mexico City,f
"Nice Apartment, Great Location.",f
Fabulous modern apartment in the city! Spacious!,f
Hab en centro historico CDMX,f
Beautiful Private Room in the Best Location,f
Beautiful new apartment in Mexico City,f
Preciosa habitación,f
Room 10 min walk from CdMx Airport,f
Beautiful Room w/ Balcony in el Centro Histórico,f
Departamento nuevo de lujo. Sur de la ciudad,f
Home sweet home! :):):),f
Suites Perisur Apartamentos Amueblados,f
Lindo departamento bien ubicado.,f
"Chalet ""The dreamer""",f
The Mexican Spot /ﾒｷｼｺの家,f
"Departamento en Peninsula Santa Fe, Mexico City",f
Beautiful contemporary Mexican style home,f
Cozy bedroom in a traditional mexican home.,f
Beautiful and cozy apartment near Reforma,f
Habitación en el Sur de CDMX,f
Departamento Veracruz - San Ángel inn,f
SMALL APPARTMENT - All services,f
"Cómodo, céntrico, cerca de Aeropuerto, Autódromo..",f
Puerta Alameda Suites - Mexico City Down Town,f
Zen Studio - High Park SantaFe Av,f
Cozy & safe place at Del Valle Sur,f
Mexican room close to dowtown Coyoacán,f
"Elegant, cozy & lovely suite",f
Plaza La Cibeles - Best apartment in town,f
Moderno & Hermoso Depa / Modern & Beautiful Apart.,f
Escandon Flat,f
"Casa del Patio, downtown Coyoacan",f
Recámara baño y cocina PRIVADOS:  Aeropuerto 9 min,f
"Pent House sobre Reforma, espectacular vista!",f
Casa del Sol-Beautiful family home in Mexico City,f
Vive la Ciudad de México,f
RECAMARAS AMUEBLADAS,f
"Top Notch Bedroom, World Trade Center, Del Valle",f
Departamento cerca de Galerias Coapa,f
Habitación privada en el corazón de la Narvarte,f
Sunny modern apartment 5-min from Reforma Avenue,f
Lovely Mexican Patio Apartment in Lomas,f
Cozy room (Col. Cuauhtemoc | Diana Cazadora),f
Fantasy bedroom in a magical environment - Condesa,f
CASA FLORES,f
Condesa Room,f
Stunning sky view flat at heart of Roma/Condesa,f
Relájate en Coyoacán,f
Moliere Polanco,f
Cuarto amplio y cómodo con baño de uso exclusivo,f
"Cozy, modern, centrally located, great views",f
Linda recámara privada en departamento en la Roma,f
Downtown space to CDMX tourist sites!,f
Habitación en Santa María La Ribera,f
Beautiful 2 bdrm apartment in the heart of Polanco,f
Habitación Privada a 3 minutos de Reforma,f
The Rescuer's Respite,f
Trendy Room Very Close to Polanco,f
PH en el Corazón de la Roma,f
La Casa de la Palmera,f
BIENVENIDO,f
LUMA BEAUTIFUL CONDESA,f
☀Lavish & Vibrant | Bellas Artes Palace+Park View❤,f
Condesa Best location ! New beautiful building.,f
Stylish room in Juarez Artist Flat,f
Casa Xola,f
"Habitación cercana al Foro Sol, Autódromo, Upiicsa",f
HISTORIC DownTown Great location Amazing View,f
LUXURIOUS LOFT  2   in Insurgentes Sur,f
Condesa  NY Designer 2 BR Apt. in FAB location,f
Top Notch Apt! Living in the Heart of Polanco!!,f
Increíble Departamento Nuevo!,f
Cuarto céntrico/Cosy room close to downtown,f
Departamento en Granjas México,f
"Departamento paraTurismo o negocios, 1 persona",f
Private apartment 15 min to downtown,f
Cómoda y agradable habitación - Nápoles CDMX,f
Acogedor loft en la colonia Del Valle,f
Experiencias Ollin bed and breakfast,f
Nice and centric apartment.,f
Terrace Roma/Condesa next to contramar restaurant,f
Recamara privada en departamento de lujo,f
"Cozy! fully equipped apartment, Viveros Coyoacán.",f
"Cuarto en la Condesa, en un bello departamento",f
Habitación con sala y baño privado en Condesa,f
NEW! Modern room w/ private bath at Polanco!,f
Stylish apartment in Rome with private terrace,f
"ILLUMINATED, EXCELLENT LOCATION, AV DE LA REFORMA",f
Beautiful apartment overviewing  a plaza in Roma,f
LUXURIOUS PENTHOUSE  POLANCO 3 BDR  GYM&ROOFTOP,f
"Cozy Santa Fe - 4 guests, 2 Bedrooms, 2 baths.",f
Prív Room 1 Single Bed. Near to Bellas Artes,f
NEW AND FOR DEMANDERS,f
Recámara individual en departamento,f
Apacible y luminosa habitación privada con baño,f
"*Special offer @Condesa, $80 usd per night*",f
The House of the Rock- Coyoacán- Room blue flower,f
casa Ajusco,f
Amplia recámara en departamento céntrico.,f
Town House with a terrace @bohochic romasur,f
"Cozy colorful apartment near WTC, Roma and Condesa",f
SERENE 2BED/1BATH APART. ON CONDESA,f
Great individual rooms for you!,f
Morada del Pedregal,f
Nuevo y acogedor departamento al Sur de la Ciudad,f
"MÉXICO, MI ∆MOR.  Depto. Aeropuerto • Foro Sol.",f
"Comparto mi depa de soltera, cerca del aeropuerto",f
Frida 1,f
Cozy room for business,f
"Penthouse con gran vista, en la Roma Sur (cuarto)",f
SANITIZED Bright Stylish Near Polanco ⭐️⭐️⭐️⭐️⭐️,f
Depa de Lujo con ubicación privilegiada LGBT+,f
Perfect Loft great Location,f
"Fully renovated, full of life & Mexican character!",f
"Beautiful 2B/2B apt. Walk to Condesa, Roma & WTC",f
"Pequeña habitación en el corazón de Polanco ""2C""",f
"Roma Norte, muy bonito alojamiento c/baño privado.",f
¡Recámara en hermoso depto y condominio de lujo!,f
Gentle haven in Roma Norte,f
Amazing and pleasant suite,f
Modern Apartment with Rooftop Pool in Coyoacan,f
Departamento cerca de zona Polanco,f
"Cozy and modern apartment near WTC, Col. Nápoles",f
Depto. Col. Cuauhtémoc a metros de Ángel y Reforma,f
Welcome to Mx City,f
Perfect Loft great Location,f
102 STYLISH LOFT near WTC With ROOF TOP,f
Spacious Clean Quiet room (own bath) in la Condesa,f
Great location in Mexico City!,f
"Deluxe 4-BR penthouse, views, historic center",f
Roma Condesa Espectacular Home,f
"Big Penthouse, Unmatched View. Great Location.",f
LOVELY LITTLE HOUSE COYOACAN,f
"Tlalpan,Close to TEC, private room.",f
Luxury Loft-Style Apartment in Vibrant Polanco Neighborhood,f
"Hermosa recámara, cerca La Condesa",f
"DF-Roma Norte,¡Best place to stay!",f
Nice and luminous apartment in Coyoacan,f
Bright and beautiful apt Narvarte,f
Green & cozy oasis at city rooftop,f
Best Views in the heart of Condesa,f
"Safe, cozy, excelent location",f
Amazing room in Center of Coyoacán,f
"Villa Conchita, Heart of Coyoacan",f
Apartment in the Historic District,f
Lovely Loft in most of the best neighborhood 97 m2,f
ONE ROOM LOFT AT LOMAS DE CHAPULTEPEC,f
In the heart of La Condesa,f
"Beautiful, sunny and airy apartment!",f
Beautiful Típical Mexican House with roof garden,f
Casa Anzures Suites,f
Amazing loft in Colonia del Valle,f
Green Man Dwelling,f
Peaceful oasis in a bustling city.,f
"Sunny & comfy flat at Roma, Mexico city",f
Céntrico departamento en la Narvarte,f
Habitacion de lujo,f
Cozy room in Condesa  @CasaNuevoLeon /22,f
Habitación Cama Matrimonial / Room at Nápoles,f
POLANCO 2 bed private room in polanco,f
Habitación privada frente a la UNAM (Master BDRM),f
WTC México Napoles.,f
NEW ROMA NORTE 2 BED/2 BATH with 24 hour Doorman,f
Vegy room con baño privado,f
"Location, Confort, Terrace... CDMX!",f
Beautiful and brand new Suites! (K),f
DEPARTAMENTO NUEVO Y UBICADO AL SUR,f
✮COZZY REFORMA✮BEST Location✮5 Stars LongStayTerm,f
Zen room in beautiful and peaceful neighborhood,f
Rustic room for rent,f
Santa Fe room close to Ibero,f
1 Pretty Room in Condesa!,f
100% for creative work or just for stay & explore!,f
Casa renta con 5 recamaras y jardin,f
Your cozy room w/awesome view / vista fantástica,f
Cool new 2-bedroom apartment in Condesa,f
Perfecto depto si vienes de trabajo o de visita,f
Duplex in Roma Norte,f
Condesa best located 3 level Loft,f
"Beautiful Loft Downtown, Amazing view",f
Depa en Tlatelolco. CDMX,f
Beautifull flat near WTC!,f
Cozy apartment in Condesa.,f
SAFE and cozy in the heart of Mexico City!,f
Beautiful and cozy apartment in Mexico City,f
Loft in Polanco,f
La bahía del visitante CDMX Colonia Del Valle,f
Beatiful room at the heart of Roma-Condesa,f
Departamento 1 recamara Be Grand,f
BONITO/AMPLIO DEPARTAMENTO EN INSURGENTES-MIXCOAC,f
Modern building in great location,f
Excelente cuarto en depto compartido muy céntrico,f
Cozy Studio.,f
"BEAUTIFUL condominium, great location!",f
Suite ejecutiva nueva equipada 201,f
Suite ejecutiva excelente 102,f
Colorido cuarto cerca del aeropuerto (15 min T1),f
Cozy room in Coyoacan,f
"Luxury Studio, S.Miguel Chapul /5mins from Condesa",f
B&B ENLA MEJOR UBICACION CENTRO DE POLANQUITO CDMX,f
Depa Cerca del Foro Sol y Palacio de los Deportes,f
"Sunny Terrace, heart of Condesa!",f
"Lovely, bright and quiet apartment in Coyoacán",f
Room with private bathroom in great location,f
Woodrow Suite,f
Beautiful apartement in the hip Condesa,f
"Súper ubicada, cómoda y muy linda.",f
"Ubicado, espacioso  y agradable depto. en el Sur",f
Exclusivo departamento 2 recámaras Polanco,f
Private room with bathroom near WTC/condesa,f
CONDESA - Great two bedroom apartment,f
Historic Downtown remodeled apartment.,f
2. Comfortable Room Near Coyoacan,f
"Residence in CDMX, perfect for artists",f
Luxury 2 Bedroom Appartment in Nuevo Polanco,f
Bohemian apartment in Coyoacan,f
COZY PRIV APT-1BD IN CONDESA CDMX,f
"Cozy, private room with bathroom",f
Beautiful room in Polanco,f
Departamento a 5 minutos de Reforma y Bellas Artes,f
Cómoda Habitación Privada muy bien ubicada,f
"Beautiful, Cozy and Huge Apartment, Col.Del Valle.",f
Beautiful apartment in Condesa,f
Cozy loft style apartment with a great location,f
Habitación amplia e iluminada!,f
Private b-room south of  the city!,f
Jardin Azul,f
Habitación tranquila en el corazón de Polanco,f
Condesa e Insurgentes,f
Urban French Studio - Roma Norte,f
Peaceful oasis in Condesa,f
En el corazón de la Ciudad! Ven y disfruta.,f
Cozy place near Mexico City downtown.,f
Beautiful Room and great views in Cuauhtémoc CDMX.,f
excellent apartment and great location in polanco,f
HistoricCenterIndoorPool,f
"AeroPuerto Foro sol CD deportiva, Palacio deportes",f
Welcome to Mexico City,f
"Recamara en casa de familia, pediatria, unam",f
Beautiful apartment in Condesa,f
colonia juarez reforma roma condesa,f
Amazing views in CDMX most central location!!,f
NEW!Beautiful apartment totally furnished near WTC,f
Pleasant bedroom in Coyoacán,f
Cozy Romita Casa,f
"Se renta loft , con acceso a alberca, gimnasio, et",f
Top location-twin bed-private bathroom-garden-desk,f
Coyoacán Beauty: Centrally Located Quiet Oasis,f
Cozy flat ideally located & connected to enjoy MXC,f
Confort Napoles!! Habitaci,f
"Location, Confort, Lots of Light! Welcome to CDMX!",f
Chic Luxury Apartment in Polanco,f
Beautiful House in the heart of the city !,f
"Room with private bathroom, Coyoacán",f
Casa en la Ciudad de México zona residencial grata,f
Patio House in Roma Norte,f
In the heart of the City! #4-3,f
Beautiful house for two with large roof terrace,f
Modern apartment two blocks from Polanco,f
Cuarto individual en zona ideal Polanco-Anzures,f
Executive & Family 3room apt. w/pool,f
Nice bedroom with good lighting.,f
"BEAUTIFUL room with balcony in Condesa, CDMX",f
Habitación en el Hostal de la Ardilla,f
Beautiful apartment in Condesa,f
"¡Top location, Queen bed and No street sounds",f
Silvia. Roma Sur recamara independiente,f
Beautiful apartment South of Mexico City,f
Stylish apt in the heart of Roma Norte,f
Bedroom in the south of the city,f
Cozy 2BED Apt walking distance to WTC/PEPSI CENTER,f
Apartment with king size bed in Reforma,f
Habitación y Baño Privado / Guanabana 77,f
DEPARTAMENTO EN LA MEJOR ZONA DE LA CONDESA,f
Condesa/escandon best location,f
Comfortable private room near Torre Mayor,f
Confortable y acogedor. Zona centro,f
Modern apartment (PA) two blocks from Polanco,f
Big bedroom with nice terrace.,f
Cozy apartment very well located in Mexico City,f
Habitación con cama matrimonial en Col. Álamos.,f
DEPARTAMENTO  EN LAS ÁGUILAS,f
Lovely bohemian apartment with patio in Condesa,f
"Cozy & Comfortable Room, Excellent CDMX location",f
Nice bedrom in a cool apartment,f
Bright room in spacious apt Condesa,f
Guest suite Roma: private room/bathroom/entrance,f
Nice and illuminated place at Condesa.,f
"""Tamayo apartment"" perfect location",f
"MX City,nice room,close to business/ turistic zone",f
"Grande, lindo y tranquilo departamento familiar.",f
Departamento luminoso en plaza Rio de Janeiro.,f
Beautiful 2 storey house with terrace in La Roma,f
"Excelente recámara,cercana a foro sol y aeropuerto",f
Airport Vs4 INN,f
King Size Room + PRIVATE BATHROOM in Polanco,f
Departamento completo para familias,f
Cozy studio / excellent location at Parque Mexico,f
Bienvenida a la Cassa Verde / White Room,f
Hermosa y amplia casa con jardín cerca del CENART,f
"Bonita habitación, muy iluminada y súper ubicada",f
Buda 13e,f
"Beautiful rooftop Room, Bath & Garden near Zócalo",f
Oasis in Santa Fe,f
Designer Loft in Condesa Built by Renowned Architect,f
Private room with private bathroom and k-size bed,f
HERMOSA CON MUCHA LUZ,f
Hermoso depa a un paso de Polanco y Carso,f
Polanco Penthouse 2 habitaciones jacuzzi excelente,f
The best place in the best area,f
Cosy safe loft for 1-2 at the heart of Mexico City,f
Private Room Paseo de la Reforma and Chapultepc,f
"WTC a 200 mts en Col del Valle, bello y tranquilo!",f
BEST service ever in Roma/Condesa- Near WTC w/2 BD,f
Great & safe apartment in the heart of the city,f
Muy cerca del Foro Sol y Palacio de los Deportes,f
Aparment Escandón,f
Habitación Privada Cerca del Aeropuerto y Metro,f
Minimalist Loft Next WTC,f
Sunny comfy room in Condesa!,f
Habitación privada p/2 personas Paseos deTaxqueña,f
Habitación privada en Coyoacán,f
"Departamento las Flores, cerca Coyoacán",f
El rincón del buen vivir.,f
MEXICAN MODERN CHIC IN THE CENTER OF POLANCO,f
CONDESA APARTMENT in a new and luxury building!,f
"Estudio privado en zona exclusiva, sur cdmx.",f
"Mi Aldea Holistica"" una conexión con la naturaleza",f
Casa de flores,f
Casa del Arbol-Comfy 2BR/Priv Terraces/Roma Norte,f
"Hip, Colorful Studio with Patio in Roma Norte",f
Liceo Franco Mexicano Polanco (Lycee Français),f
Condesa's Plush  (G8),f
"Private room in La Roma, great location!",f
Chiky Home,f
New apartment next to WTC Mexico,f
Beautiful Colonial House in the heart of Coyoacán,f
Excelent Suite Polanco Area,f
Departamento compartido,f
Enjoy The Artistic “Escudero” suite with balcony,f
Habitación doble a 50m de la av más lujosa,f
Recamara amplia c baño privado a 4 cuadras del WTC,f
LargeGroups ✔6BR ⭐  Business & Touristic Area,f
"Nuevo de Lujo,Moderno,Col.Roma Nte. Seguridad 100%",f
Super departamento de 130m2 2 recamaras 2 balcones,f
Sunny Diamond | Private Roofgarden,f
Habitación en San Jerónimo,f
Cozy apartment Col Roma’s heart - 2 bikes included,f
MODERN Complex with POOL in Historic CENTER,f
Private room&bathroom in beautiful new apartment,f
Casa ReDoMa,f
City's Historic Center spacious apartment wtapanco,f
Apartment in most elegant area south of Mex.city,f
Big bedroom in San Miguel Chapultepec.,f
1 Room / Parque Hundido / Noche Buena / CDMX,f
Lindo departamento céntrico en la Narvarte,f
Cozy apartment in Roma Norte,f
Moderno Departamento al SUR de CDMX,f
Gorgeous appartment in the heart of Mexico City,f
Habitación con excelente ubicación en Narvarte,f
Comfy and economic Room with doublebed in Coyoacan,f
Pequeño y lindo espacio con baño * 15' aeropuerto,f
Downtown Illuminated and chic apt with balconies,f
Comfy Art Deco Flat in the Heart of La Condesa,f
Cozy modern apartment in 16th century Coyoacán,f
Depa en San Jerónimo,f
Hermoso departamento cerca del World Trade Center,f
Recámara en Escandón,f
Departamento iluminado y bien ubicado,f
Lovely downtown apartment,f
Departamento al sur de la CDMX,f
Beautiful apartment in Pedregal,f
Private room in Colonia Nápoles,f
Habitación con toque artesanal a 10 min del Zócalo,f
Reforma w’ Love,f
Awesome Private Room at the heart of Nápoles,f
Av. Reforma-Comfortable Apt. in a perfect location,f
"Nice Room in Coyoacán,  cerca shows CDMX",f
Tita and Taco's corner,f
Luxury apartment in Condesa.,f
Amazing Penthouse in Polanco.,f
Full Suite. Amazing View. Hotel Amenities. K11,f
Best flat in Reforma. Suite. Jacuzzi and gym. K12,f
Tu casa,f
Big room 15 min for Coyoacàn,f
Habitación amplia y confortable en CDMX.,f
"Zona de Hospitales, Tlalpan, Sur Cdmx.",f
Rio Lerma 64,f
Habitaciones cerca de Médica Sur y Zona Hospitales,f
Excelente habitación a 5 min de la basílica,f
"TRENDY HOSTEL / Yes we speak English, Welcome !!!",f
Recorre el barrio de Frida Kahlo desde esta habitación de estilo colonial,f
Habitación Ejecutiva en Departamento Amplio,f
Apartment a block away from the US Embassy,f
Hermoso penthouse en la Ciudad de México,f
Sweeping city views condo at Mexico City Center,f
Classic 1930's Condesa house with beautiful patio,f
Habitación con una cama nueva/casa cocina nueva,f
Casa bixxi,f
Bonito y bien ubicado depa Polanco,f
Habitación amplia y cómoda en departamento.,f
Complete Apartment Santa Fe Qbicco Front View,f
Beautiful room in multilingual family home,f
"Private Suite, Spectacular Terrace, Housekeeper!",f
Suites Anzures 5 personas,f
Departamento con la luz más bonita en CDMX,f
"INTERLOMAS, CASA HERMOSA ACOGEDORA CON VIGILANCIA",f
Hermosa casa en el corazón de la condesa,f
Downtown industrial cozy private room,f
Hermosa habitación privada en la Roma Sur,f
Habitación con balcón,f
A room with a view,f
Habitación SU suite1,f
Hospedaje en Estudio de Yoga. CLASE incluida !,f
La casa de Adrián.,f
Departamento en Colonia Condesa,f
Private Room w/ shared Bathroom near Universities,f
La Casa Naranja tu casa. Diego Rivera Single Room,f
Casa de la Independencia Master Bedroom,f
Casa Claudia,f
Hermosa habitación privada  en la del Valle,f
The House of the Rock- Coyoacán- Room green flower,f
"Nápoles, Amplio departamento WTC 1 recámara",f
Adorable apartment at 15 mins walk from the WTC,f
Cómoda y amplia habitación,f
Best Experience in Mexico City,f
Departamento acogedor,f
The Best Apartment in Condesa de 135 m2,f
"Coyoacán Del Carmen, Recámara+salita (C. Mali)",f
"⚡Por Insurgentes sur, cómodo, ubicado,  y seguro ☘",f
PRIVATE ROOM IN SUPER LOCATED DEPARTMENT,f
DEPARTAMENTO CON VISTA A WORLD TRADE CENTER,f
Barajas 85,f
Excelente habitación en departamento San Jerónimo,f
LOFT INDEPENDIENTE CERCA DE COYOACAN Y CHURUBUSCO,f
"Amazing, spacious apt in the heart of RomaNorte",f
"Ciudad Universitaria, Copilco.",f
Arranca tus días en la espectacular terraza privada de este Penthouse,f
CASA FAMILIAR CDMX ALOJAMIENTO ENTERO BUEN PRECIO,f
FUNCAYA ROOM,f
HOSPÉDATE COMO EN UN HOTEL 5* EN NUEVO POLANCO,f
Room in Polanco with Gym and Terrace.,f
Amazing apartment in the heart of Condesa @CdMx,f
Cute Central Unit (Polanco-Chapultepec-Downtown),f
QUIERES ESTAR EN EL CORAZÓN DE LA ROMA?,f
Calm Room in Tree Filled Hipódromo Condesa,f
"Departamento Ubicadísimo Aeropuerto, TAPO, ForoSol",f
Green and sunny room in Roma Norte,f
¡¡Increíble departamento!! Super centrico.,f
Espectacular Apartamento en Coyoacán c/amenidades.,f
Small apartment in Coyoacan,f
Un Oasis cerca de la condesa.,f
"Habitaciones cerca de Santa Fe, con refri y micro",f
Beautiful city view and stylish apartment,f
Private room in Polanco with bathtub and a/c,f
Crossing st. from Alameda Central Park,f
CONFORTABLE Y MARAVILLOSO DEPARTAMENTO!!,f
cerca hospital Ángeles del Pedregal y  H. De PEMEX,f
DB Habitación en hermoso departamento Polanco CDMX,f
Amplio y hermoso departamento en la Condesa,f
Televisa San Angel - Habitación simple/Área segura,f
Beautiful and Sunny Room with perfect location.,f
LOVELY apt in the heart of COYOACAN!,f
Beautiful apartment in Del Valle (WTC),f
LOFT EXCLUSIVO EN EL CORAZÓN DE COYOACÁN,f
Nice retro apartment in front of a park.,f
Luxury Appartment at Roma,f
El rincón de la Yaya,f
"Loft Copilco. Amazing, UNAM, CEPE, GMartell",f
M4 -SAN ANGEL-CLINICA 4 IMSS-TELEVISA Doble Grande,f
Habitación en San Miguel Chapultepec,f
Santa Fe - Spacious & modern Apartment,f
Cómoda habitación en Santa Fe y alberca incluida.,f
Habitación en hermoso PH a 5 min de Polanco/condes,f
"Hermoso departamento nuevo, con excelente vista.",f
Cómoda habitación en zona rosa,f
Bruno’s bed and breakfast,f
Hermoso departamento en Polanco,f
VERTIZ COMODIDAD,f
Espacio cómodo con excelente ubicación,f
Dormitorio  a 10 min Metro Línea 2,f
Habitación UNO,f
"Incredible and quiet 2BD, 2BA fully equipped Apt",f
"Habitación  Carso, Miyana, Antara Nuevo Polanco 1",f
Condesa Dreams ! June 35% off  (discount )included,f
LOFT ZONA POLANCO/LOMAS SP02-D,f
