name,host_is_superhost
"Juan O'Gorman House - Studio, ",t
Business Suite PURPLE near Reforma,t
HABITACION CON BAÑO IND AEROPUERTO ,t
Beautiful designer artists home..,t
¡ Hermosa habitación en la Ciudad de México !,t
Art Deco in Condesa King,t
A small independent space,t
HABITACIÓN PARA UNA PERSONA. CENTRICA Y ACOGEDORA,t
Amazing Loft @ Iconic Building R27,t
Heart of the hippest hood in DF,t
"SAN ANGEL / SAN ANGEL INN, picturesque area (3).",t
"Habitacion, Plaza Carso y Antara",t
"Habitación en Amsterdam, Mexico City",t
COZY MODERN ROOM ( Monterrey Room Condesa Haus ),t
"Loft con terraza, cerca Plaza Carso",t
Lovely private room in Coyoacan,t
4B - Suite Bazaar San Angel (1BR/1BA Double),t
Art Deco in Condesa Queen,t
THE BEST PLACE AND LOCATION,t
Near UNAM: in the heart of Coyoacan Room A,t
Tropical relax gem apt. Independent BR w/small BA,t
LOCATION & COMFORT IN SANTA FE,t
"Apartment in Polanco, Mexico City",t
Small Roof Department Private,t
Habitación privada con baño.,t
Nice room near UNAM,t
Cozy Studio near Museo Antropologia,t
Bedroom in apartment in Lomas de Chapultepec,t
COZY LOFT APARTMENT CONDESA,t
Cómodo cuarto en villa olímpica,t
Bright and cozy studio in Condesa,t
Habitación  c/baño privado para mediano plazo ,t
"Bright & Spacious, Superb Chic Apt in Condesa",t
Cozy and Great Location!!!!,t
"El Cuartito, Santa Fé & Universidad Anáhuac",t
Business Quality Suite - Narvarte,t
Sunny Apartment in Colonia Del Valle,t
Inmejorable Ubicación en Santa Fe,t
Cozy spacious room in Art Deco building in Condesa,t
Location Location in Polanco,t
Luminoso departamento con bello balcón.,t
Polanco Newton D.F.,t
"Frida´s Neighbors, Coyoacán",t
PRACTICAL EXECUTIVE STUDIO AT 3 BLOCKS POLANCO,t
estudio independiente al sur,t
"Private Room, 3 blocks from Reforma",t
"Big, iluminated, cozy room. Polanco",t
Very Centric & Cozy Flat at Reforma,t
Sunny apartment on Parque México,t
Plaza Carso Apartment,t
Private equipped Suite WiFi dbl bed,t
Amazing Loft  with Great Location!,t
Casa Molcajete,t
ALOJAMIENTO ZONA NORTE DF,t
Loft centro Tlalpan,t
Private dbl room w/BA in lovely & quiet rooftop,t
Beautiful  private room,t
Habitación privada cerca de Polanco,t
19th Century House Garden Studio,t
Live  in the heart of  La Roma!,t
Confortable Room in Del ValleCentro,t
"Cozzy appart, 3 blocks from Reforma BEST LOCATION",t
"Casa Donceles Plus Apt 5❤️Groups, family, friends!",t
Perfect WFH/Staycation 3BR/2.5BA w/Interior Patios,t
Apartment in Iconic Building Overlooking Revolution Monument,t
Comfortable and centric appartment in Roma norte.,t
Beautiful PH in Parques Polanco,t
Cozy Art Deco flat,t
Suite Monalisa Cocina/baño Coyoacan/tlalpan/coapa,t
Cozzy room in a very nice city area,t
Spacious room with private bath close to Polanco,t
"Cozy, new, excellent location",t
Habitacion amplia en Polanco con estudio privado,t
Industrial and Rustic One-Bedroom Mexican Loft,t
Room 1 House of Light and Color in Coyoacan,t
Bright and spacious bedroom in Roma,t
2BR / apt in the heart of Downtown,t
"*Suite #511, 01 Recámara- 01 Baño",t
Vive la Condesa,t
Comodísima habitación,t
JUNIOR SUITE,t
JUNIOR SUITE TERRACE,t
MASTER SUITE,t
Gorgeous Condesa House with Beautiful Private Garden,t
"Room 4 House of Light and Color, Coyoacan.",t
"Bright, Modern, Cozy Apartment & Great Location",t
RENOVATED 3 STORY HOUSE in the HEART of COYOACAN!,t
"Heart of Coyoacan near UNAM, Room C",t
"Ubicadisima, bella y super equipada",t
Excelent 02 level-01 Bedroom Apartment,t
Habitación detrás del WTC y Pepsi Center,t
Bonito departamento de 62 m2 acogedor y centrico,t
RECAMARA CAMA MATRIMONIAL Y DESAYUNO CONTINENTAL,t
Room 2 House of Light and Color in Coyoacan,t
WTC: COZY & FUNCTIONAL,t
Cómoda suite en la colonia Juárez (Master suite 4),t
Eco & Cozzy apartment very near la Condesa,t
Bonito Depto A/C- Excelente Ubicación,t
Casa José Clemente Orozco Coyoacán,t
"Lovely independent room, great location, Polanco.",t
CDMX + Cuernavaca,t
"Nice, big and welcoming room in the south of CDMX.",t
Beautiful comfortable bedroom in our apartment 4 u,t
"Habitación doble, acogedora  en Fracc  Residencial",t
"Cuarto , estudio y baño privados en la Roma Norte",t
Cool+Nice: 2bedrooms at same apartment in Polanco,t
"Comoda habitación, cerca de Condesa, MB Nuevo León",t
"Polanco tourism, business, rest like home !!",t
Cuarto Iluminado en casa espaciosa 2,t
Polanco | 2 Apartments 1 Building,t
"Highend Classic Building,BedRoom/office,Woman only",t
Apartment close to Tec de Monterrey,t
Polanco Terrace 1 Bedroom & Terrace,t
Moderno departamento en Coyoacán,t
Departamento ideal para estudiantes.,t
Private room w/breakfast in the heart of Roma,t
"Casa 16. Cálida, confortable y luminosa",t
"Mayan Sparrow, Stylish Apartment in Casa Quetzal",t
Cómodo departamento Art Deco en la mejor ubicación,t
SPACIOUS Private room in CONDESA! No other guests.,t
"Nice private room in Coyoacan, near UNAM",t
Quiet bedroom at Condesa w private bathroom & trce,t
El Rincón de Cristina,t
"Exclusive apartament in Polanco, Carso.",t
LICHA - Gorgeous Master Suite in Condesa,t
Frida's Suite in Condesa by La Palomilla BNB,t
"CHAYO, B&B´s Very Comfortable Suite in Condesa.",t
"CHELA, B&B´s Lovely & Beautiful Suite in Condesa.",t
"TOÑA, B&B´s Very Nice & Beautiful Suite in Condesa",t
"MECHE, B&Bs Very Cozy & Beautiful Suite in Condesa",t
Amplio Depto con Terraza,t
Great location in Santa Fe-Mexico City,t
Appartment South Mexico City,t
Best Apartment in Santa Fe! Spacious and Cozy,t
Cabaña Veranera o  Cabaña  de los Platos,t
"Cuarto cerca del Plaza Condesa , ambiente familiar",t
Best location/ a dos cuadras del Ángel en reforma,t
Comfort en el centro de Coyoacán CDMX,t
Precioso departamento en la Juárez,t
Casa privada/ casa completa,t
Charming Renovated House in the Heart of Santa Fe,t
"Room 3, Cálida habitación Doble casa californiana",t
Suite acogedora en casa californiana,t
"Roma Norte,  Apt. dos recamaras, un solo piso.",t
Private room w/bath exc. location!,t
Apartment in trendy Polanco / Carso/ City Towers,t
Cuarto en departamento nuevo muy cerca de Reforma,t
Cozy apartment in Polanco area,t
Two doble bedroom & terrace in the Historic Center,t
Habitación privada al norte de la Ciudad,t
Basílica: Beautiful room with private bathroom,t
EN CASA,t
CHIC GUEST HOUSE ★ Blue Private Room ★ Centric,t
"Esta es tu casa, tu refugio urbano",t
Habitación coyoacan en jardín,t
Huge-beautiful house-roofgarden -terrace amazing!,t
Fer's Place in Polanco. Two floor apartment.,t
TU CASA,t
Welcome! Cozy room in Mexico City,t
Your Place in Mexico City,t
MEXICO CITY APARTMENT,t
CASA EN COYOACAN,t
Nice room in charming beautiful house.,t
Feel at home at La Condesa,t
"Casa Lipari.  Comodidad, ubicación, Planta Baja",t
Big and spacious room in a lovely condo.,t
Moderno Departamento en Condesa,t
Nice room near Reforma and Angel,t
DEPARTAMENTO NUEVO AMUEBLADO A 7 MN DE SANTA FE,t
STUDIO GARDEN,t
Centric aparment for CDMX,t
Comfortable Room in La Condesa,t
Nice and bright apartment in Santa Maria la Ribera,t
Stylish Loft with lightwell balcony,t
Cuarto privado en departamento con mucho estílo,t
LA CASA DE ANTU,t
Depaterraza SALE!$17000 por mesMUY CERCA deSta Fe,t
AMAZING  PANORAMIC APARTMENT IN SANTA FE,t
Casa Martina Romantic ArtDeco house.,t
Habitación Privada en moderno Depto,t
Large apartment 1 block from Reforma,t
BONITO DEPARTAMENTO BUSSINES OR PLEASURE,t
lovely apartment A 7 minutos de expo santa fe,t
Four unique rooms- La Palomilla Bed and Breakfast,t
SWEET TROPICAL TOWNHOUSE - Roma/Cibeles,t
GREAT LOCATION!LOFT 1  BEDR. FUNISHED AV. SANTA FE,t
(2) Hermosa Habitación Vista Panorámica,t
Private boho chic apartment,t
Room in Wonderful Apartment w/ Terrace in Condesa,t
Cozy apartment in the heart of downtown (1 room),t
Elegante departamento soleado,t
"Central Roma Norte zona Rosa, private bath",t
Departamento con terraza. Céntrico,t
Great apartment in Roma Norte / Best Location,t
Cozy room at south Mexico City,t
Large bedroom with direct access to bathroom,t
2 Bed / 2 Bath Apt. in Santa Fe Business Center,t
Habitación con salida a jardín j1,t
Cozy private bedroom in Coyoacan,t
Top Location - Private Room Picturesque San Angel,t
Trendy and Cozy Apartment in Condesa,t
OM686 la mejor opción de hospedaje en CDMX,t
Safe and calm colonial house,t
"Anzures: Beauty, cozy & cosmopolitan charm",t
Lush Views of Parque Mexico from an Expansive Balcony,t
Habitación independiente con baño,t
"The Marakame Crow, Deluxe Flat in Casa Quetzal",t
"independiente, céntrica, espaciosa",t
Private Room in Picturesque SAN ANGEL area,t
Habitaciones con terraza. Mejor ubicaciòn,t
Cuarto Pitaya. Amplia habitación en Coyoacán,t
Sunny & spacious room / rooftop patio / near Roma,t
225_Suite con Desayuno en Polanco,t
140_ Habitación en Polanco para 1 o 2 personas,t
Apetecible roof apartment con terraza privada,t
Room with big closet @ Casa VAA (Condesa area),t
"Cómodo, excelentes amenities, increible ubicación.",t
Cuarto Magnolia. Cozy room in house in Coyoacan,t
Cuarto Orquidea. Cheerful private room in Coyoacan,t
Art Deco in Condesa Black,t
"⭐CBD, near Polanco, +300Mbps. Sanitized, clean kit",t
Cozy Junior Suite B&B in Santa Fe-Villa Verdún.,t
Nice bedroom in colonia Del Valle,t
"Habitación privada, sur de Cd. d México (Coyoacan)",t
"TrAnQuILo, HerMoSo y CaLiDo eSpAciO aL SuR dE CDMX.",t
HAVRE Cincuenta y Dos,t
La casa de  blanchis,t
Fantastic location in Santa Fe 3- Mexico City,t
Habitación principal de departamento,t
Casa Magy,t
"Modern 2 floor PH, Roof Garden@Del Valle, Near WTC",t
Room near to Parque Hundido,t
DF Ciudad de México en el Centro de la ciudad,t
Happy Bnb,t
❤️ OLYMPIC VILLAGE AZURE⭐COMFY & CHIC,t
Los mejores Lofts en Ciudad de México,t
Habitación para estudiantes y viajeros,t
Cuarto con baño privado,t
Charming Loft with Sunny Terrace in the Heart of Coyoacán,t
Suite independiente en Ciudad Universitaria UNAM,t
Hermoso departamento en la Napoles,t
"LOFT MUY BIEN UBICADO, LIMPIO Y SANITIZADO",t
"Departamento "" Oliva Coyoacán """,t
Habitacion Confortable por Basílica de Guadalupe,t
Elegant Art Deco Home with Garden in Condesa,t
Modern & Secure private room! Welcome foreigners!,t
Departamento de Lujo Santa Fe Ciudad de Mexico.,t
Room Árbol: Nature - with 100 year old tree,t
"Clean, safe, full of light: heaven in Condesa!",t
Super Suite  Lujo en Pte  Max seguridad y comfort,t
Luxury loft in Historic Mexican building,t
Beautiful and super well located (Room 1),t
Beautiful and super well located (Room 2),t
"Bonito Depto, a 20 min del Aeropuerto, CdMx M",t
"Depto Cerca aeropuerto, Foro sol, Palacio deportes",t
Best Home-Office at Condesa,t
Lucia's Room,t
Pola's Room,t
Habitación privada cerca Wtc,t
Casita Condesa ideal habitación para el descanso,t
Habitación Nah Kóokay al Sur de CDMX,t
"Habitación acogedora, metro Nativitas Gay Friendly",t
Ideal para estudiantes en ambiente familiar,t
Bunker Chic Apartment,t
Casa-Boutique en Condesa con Arte Mexicano,t
Cuarto con baño en Villacoapa.,t
Cozy room w/private bathroom (50mts. from Masarik),t
Two Exquisite Large Apartments and Roof Garden in La Condesa,t
#CamPeChe 3. Cozy apartment with private terrace.,t
"Casa Comtesse B&B - Hotel Galería ""Malinche""",t
"Condesa Boutique Designer Apt. 3BD, 3BA",t
Acogedor y Amplio Departamento cerca del Manacar,t
Tu hogar en Coyoacán cómodo y tranquilo,t
"Condesa Boutique Cool Apt. 3BD, 3BA",t
Recámara privada a 5 minutos del INNE hospital,t
“Zula” Recamara(s) individual en departamento,t
COZY SPACIOUS ROOM IN LA CONDESA,t
Cómoda y relajante habitación en la Roma,t
"Lovely private room near UNAM, Coyoacán and CEPE",t
3 amplías habitaciones de lujo con baño cada una,t
"Beautiful, safe apartment home near Coyoacan!",t
El mejor concepto de alojamiento en CD de Mx,t
Departamento amueblado,t
"Cerca de Chapultepec, Habitación Privada",t
Designer Loft with Vintage Charm in Coyoacan,t
Loft @ CONDESA,t
CERCA DEL CENTRO  Boleo 57 Ciudad De México.,t
"Habitación de lujo, amplia, con baño privado",t
2 Habitaciones de lujo con baño cada una,t
Home Office Loft Polanco,t
Cómoda habitación en Roma Sur por Centro Médico,t
Habitacion a 10 minutos del aeropuerto,t
Espacio con Estilo en el Corazon de  Col. Napoles,t
CDMX Fantástico Departamento de Estilo en Piso 18,t
Great executive apartment in the heart of CDMX,t
Apartment in Zona Rosa,t
Centro de Coyoacán a 10 minutos del departamento,t
Dagus apt King size bed and sofa bed ideal couples,t
Recámara en la Col Del Valle,t
Super Loft  Lujo en Pte Max comfort y seguridad,t
Beautiful town house at the heart of Colonia Roma!,t
Amplia habitación en Polanco,t
Habitación luminosa y cálida en Polanco,t
Precious Apartament in Front of American Embassy,t
Departamento Zona de hospitales,t
Excelente habitación privada c/baño Sillón+escrit.,t
30% PayLess Long Stays Carso Luxury Amenities,t
New Apartment in the most centric zone in town*,t
Comfortable Suite in a Beautiful and Stylish Boutique Hotel,t
Beautiful apartment in San José Insurgentes,t
Habitación de lujo con cama matrimonial y sofácama,t
City Santa Fe Apartment 906,t
HUGE LUXURY APARTMENT REFORMA 3 BEDR GREAT VIEWS!,t
"Silencioso, Cómodo y Amplio Apartamento en PB.",t
Apartamento Precioso y Nuevo. Impecable. Llegada autónoma. Junto a Torre Manacar,t
"Loft equipado cerca de parque, corporativos y mall",t
"Bello, armonioso y limpio departamento HARES",t
Exclusivo  nuevo departamento con terraza privada,t
El mejor Apartahotel con 16 departamentos nuevos.,t
"The most centered, beautiful and secure space.",t
Hab Lujo zona residencial Poniente comfort max,t
Cozy and bright apartment in great location,t
Departamento residencial con excelente ubicación 1,t
Private room in excellent ubication Del valle,t
Room  in Xochimilco.,t
Kramer Suite in Roma Condesa by La Palomilla,t
Room with private bathroom 10m Airp,t
Admire Mexico City from a Twinkling Balcony by La Palomilla,t
Rana cozy suite ensuite bathroom by La Palomilla,t
cama matrimonial c/sofá/smarttv/ cuauhtémoc / cdmx,t
Habitación Privada  en  Depto  Compartido,t
Sit in the Private Rooftop Garden of an Exceptional Home,t
Habitación independiente con terraza privada.,t
Nuevo apartamento soleado (new sunny apartment) 6p,t
Have Rooftop BBQs with Views Across a Trendy Neighborhood,t
"HOUSE 4 BDR/ 4.5 BTHR , 8 PEOPLE SOUTH MEXICO CITY",t
Condesa´s 8BR/8BA in 4 Apts @same building,t
Cómoda habitacion rodeada de bosque,t
COZY PRIVATE ROOM Rosé Room at Condesa Aurora,t
Rest Relax & Discover Beautiful Apartment,t
"Condesa, Private Terrace overlooking Parque España",t
Solo habitación en Ciudad de México,t
Perfect for big groups together @ Condesa.,t
Stunning Condesa Gem,t
Private room in nice apartment near Coyoacán.,t
"2 Rooms, Best area for Concerts & Events & Airport",t
"Cozy new apartment in Coyoacán, near frida’s House",t
Anzures: Comodidad y encanto cosmopolita,t
Splendid Penthouse in Polanco,t
1. Cozy Private Room in Polanco (PH),t
Sunny  loft with a big terrace in a historic area,t
Depa entero cercano a aeropuerto CDMX,t
Cozy&Unique.Parque (Website hidden by Airbnb) Valle,t
Loft  Insurgentes Sur,t
Room @ Reforma,t
"NJ13-P401, @3 blocks from World Trade Center!!!",t
Amplias Habitaciones  cerca del Ángel y Chapultepe,t
Departamento en Condesa,t
Hermosa Habitación Privada en Roma Norte,t
❤️ OLYMPIC VILLAGE CRIMSON ⭐WARM & COZY,t
❤️ OLYMPIC VILLAGE AQUA ⭐COZY & SAFE,t
Habitación Anáhuac Sur/UTEC CFE/Santa Fe/ITAM (A),t
"Villa Coapa, dúplex, súper luminoso y ventilado.",t
Family Traveling Apartment in Polanco 2 Br 2 Bth,t
"Comfy and cozy studio, downtown, lovely views",t
Nice room in the south area of the city.,t
"Cozy room within a great city zone, Mixcoac",t
Recámara solo para damas,t
"Hermoso departamento, amplio y cómodo en Roma Sur",t
Casa de DOS  NIVELES-Familias o Grupos Bienvenidos,t
Brand New Appartment downtown!!,t
Designer apartment with private rooftop garden,t
Monte Alban Room house in the heart of Coyoacan,t
Chichen Itza Room house in the heart of Coyoacan,t
Tulum Room house in the heart of Coyoacán,t
Palenque Room house in the heart of Coyoacan,t
Tajín Room house in the heart of Coyoacán,t
Private confortable little appartment,t
Suite in a Charming Colonial Villa in San Angel,t
Mexican Style room at the heart of Condesa!,t
Lovely apartment with beautiful rooftop in Condesa,t
Gorgeous apartment at the heart of La Condesa.,t
Alabama 35,t
Acogedora casa cerca de estación de metro,t
Paulina Cat’s,t
Tezca. Departamento con terraza privada.,t
Nice and comfortable room,t
"Habitación sencilla 1p, con ubicación estratégica.",t
Spacious appartment - heart of trendy Roma Norte,t
"Condesa, by Roof Garden in front of Parque España",t
"Magnifica habitación, baño privado, cama king size",t
corazon de la CDMX,t
Cuarto en casa,t
Amazing apartment at Condesa,t
"Roma sur, cerca de todo",t
Departamento Alfonso Reyes,t
"NJ13-P502, @ 3 blocks from World Trade Center",t
Bonito cuarto privado con acceso directo a terraza,t
☀ Spacious & Modern 1 BR apt with Amazing View ☀,t
Private room and bathroom in heart of Condesa,t
Be Grand Coyocán,t
“Luxury Apartment” 3 Bedroom 2 Bathroom,t
Spacious Roma Norte Apartment with Private Terrace and Grill,t
4.20 friendly / Traditional centric neighborhood,t
Departamento céntrico a 3 minutos del aeropuerto,t
Cuarto con escritorio,t
Habitación amueblada al sur de la CdMx,t
"Private Rooftop Room in a Hip, Refined House in Anzures",t
Casa Montserrat Coyoacán Habitación doble,t
Chimenea JARDIN ZEN Embajada USA A 350m Reforma222,t
Beautiful Mexican-style room with garden view,t
Cabañas para 6 personas en el Ajusco CDMX,t
Amazing location and view. Vive el corazón de cdmx,t
Modern apartment in Colonia del Valle. Perfect!,t
¡Habitación en departamento súper lindo! Zona Sur,t
PH with City View in Lively La Roma Norte,t
Nice bedroom with private bathroom near Coyoacan,t
Bedroom available near to Coyoacan and UNAM,t
Habitación Coyoacán División del Norte,t
One bedroom apartment @Roma Norte,t
"Security and comfort in South Side, Mexico City",t
"Suite independiente, acogedora, cerca UNAM y metro",t
VIEWS! SPACE! Penthouse El Cielo de Roma,t
*NEW*.  Fresh Style! Polanco. Pool. Security.,t
Mi CASA,t
APARTMENT  SANTA MARIA LA RIBERA NEAR TO DOWNTOWN,t
Departamento nuevo amueblado  a 7 min de santa fe,t
Habitación amueblada cerca  hospital español wifi,t
Cactus Private Terrace | 2BR | Roma,t
Cómoda habitación para estudiantes o viajeros,t
Centro de Coyoacan Habitación clean and sanitized,t
POLANCO Habitación con baño privado de lujo!,t
Waking distance,t
Basílica de Guadalupe,t
Private Room& BR. Super location. Ubicación de 10,t
Bright New-Build Apartment W/high Speed Internet at Condesa,t
TORRE CUADRO,t
Private room in Colonia Juarez - awesome location,t
Beautiful Master Bedroom in La Roma Norte,t
Fortune Terrace | Roma | 2BR,t
Casa Caoba,t
Private room,t
Gigantic ! 4 Bedrooms,t
Linda y cómoda habitación,t
"Suite entrada independiente, cerca UNAM y metro",t
Habitación privada en Polanco,t
Apartment with a perfect location at Polanco,t
Suite Casa Amarilla,t
Apartamento en Nuevo Polanco con Espectacular vista,t
"WTC ONE block, room w/bathroom  near Condesa/Roma",t
Bright apartment w/private bathroom 601 @SantaFe,t
Amazing Apartment 2BR 1201 @SANTA FE,t
CLEAN&GREAT DPTO 2BR 301 @Santa Fe,t
Lucha Libre Suite in Condesa by La Palomilla B&B,t
Designer Latitude | Balcony | Gym,t
Habitación privada en Coyoacán con cocina y garage,t
BEAUTIFUL PRIVATE ROOMS NEAR CHAPULTEPEC,t
La Concepción corredor Malinche Centro de Coyoacán,t
Habitación privada en apartamento nuevo,t
LA CASA DE JESÚS EN COYOACAN Habitacion III de 15,t
Stylish and quiet bedroom for 2 Polanco Masaryk Av,t
Habitación privada en Ciudad de México,t
Todo incluido y gran espacio al sur de la ciudad,t
Close to WTC,t
3 Independent Apartments with Shared Terrace,t
Amplia habitación sobre Av. Álvaro Obregón.,t
Oasis en la Ciudad,t
Large Room 2 Bds/1 BA at Casa La Terraza Condesa,t
The View,t
Cozy Room in a Trendy Apartment! Awesome Location,t
Elegant Executive Apartment in Polanco,t
Departamento Estudio en zona trendy Col. Juárez,t
La casona de Carmelita (Monumentos),t
LA CASA DE JESUS EN COYOACAN II,t
LA CASA DE JESÚS EN COYOACAN Habitación V de 15,t
LA CASA DE JESUS EN COYOACAN Habitacion VI de 15,t
LA CASA DE JESUS EN COYOACAN Habitacion XII de 15,t
LA CASA DE JESUS EN COYOACAN Habitacion XI de 15,t
"Habitación Santa Fe, Arcos Bosques, Ibero , CIDE",t
"Residentes SigloXXI, H.Infantil, Hop Gral Céntrico",t
Habitación en departamento a 3 cuadras del Ángel,t
México prehispánico,t
Your Room in CDMX’s nicest & most convenient area,t
Place to relax,t
"Depa en Guadalupe Inn// San Angel, Coyoacán, Sur",t
Suite “Baúles” en Coyoacán cerca UNAM-C.U.,t
Private room in bright and spacious apartment.,t
Silenciosa Habitación cerca de Universidades.,t
Cozy private and idependent room close to UNAM,t
Gorgeous apartment close to hospitals/universities,t
Amazing entire apartment in Plaza Rio de Janeiro,t
"Habitación Santa Fe, Arcos Bosques, Univer Ibero",t
Cuarto para 2 personas en CDMX.,t
Acogedor departamento lleno de detalles felices,t
"Comodiad y seguridad, sur de la ciudad",t
Pequeño espacio agradable en coyoacán para mujer,t
"PL202 Ciudad De México, Loft en Polanco",t
"""La Españolita"" gem in Mexico City",t
Private Room for 2 at Casa La Terraza Condesa,t
"Business, tourism, location, new apt for you!",t
Modern & Comfy 1 bdr and 1 bthr Apt. in Polanco,t
Private Room with Bunk Bed at Casa La Terraza,t
Bonito departamento en CDMX,t
6BR/6BA in 5 Private Units at Condesa house.,t
5 fully equipped private units in Condesa house.,t
4 fully equipped private units in Condesa house.,t
Unit 4 Air Conditioning Condesa,t
Unit 5 Air Conditioning in Condesa,t
Stay at Two Updated Apartments in Trendy Condesa,t
Apartment 106 at Paris 10 Apartments - Mexico City,t
Habitación con baño privado,t
Sierra Candela PB1,t
Solo habitaciones en Ciudad de México,t
Habitación La luna en hermosa casa porfiriana,t
Departamento en Cuajimalpa a 5 min de Santa Fe,t
Hermosa casa colonial en la mejor zona. San Ángel,t
"COZY appartment, great LOCATION!",t
Stylish NEW apartment CDMX superb location & price,t
"Renovated loft, terrace, quiet,  limit Polanco",t
2 recámaras con baño p/4 personas en fin de año.,t
Departamento entero CDMX a 10 min basílica,t
great cozy 1 bedroom apartment WTC,t
"Unique Penthouse w/Rooftop Terrace, Central Loc.",t
Easy Stay 3.0.,t
Full apt at Roma norte at EspacioGomaga,t
Departamento 250m2 en Ciudad de México,t
Perfecta ubicación!! A 10 min del Aeropuerto,t
Cheery apt in San Pedro · 2 BR · 2 BTH · 1 PK,t
12 habitaciones en una bella casa con jardines,t
Habitación ZONA DE HOSPITALES y Tec de Mty,t
"Vita Polanco, Luxury Apartment.",t
Apartment 207 at Paris 10 Apartments - Mexico City,t
"Habitación al sur de la CDMX, Tlálpan ( 1 huésped)",t
Apartment 607 at Paris 10 Apartments - Mexico City,t
Habitación  privada muy cerca de WTC (Az#2),t
La casa de María. Habitación ámbar para huéspedes.,t
BIENVENIDOS A CASA! -DESCUENTOS SEGÚN ESTANCIA!,t
Hab privada c/baño compartido (Metro portales),t
Apartment Downtown 2 Rooms 1 to 8 Guests / 707 /,t
Mi casa,t
"Habitacion doble V, T.V. Amplia, luminosa, comoda.",t
Hermosa habitación en la mejor zona de la ciudad.,t
"Elegante, cómodo y recién renovado loft.",t
Edificio México Chulo - Apartment 101,t
CASA MAYA TIENE UN ESPACIO PARA TI,t
Depto. equipado CDMX con excelente ubicación.,t
Find Calm in the City at a Polanco Pad in Shades of Gray,t
★ CDMX Historic DWTN ★ Rooftop | 6 bds | Reforma 5,t
"GREAT & SAFE LOCATION IN MEXICO CITY, NAPOLES, WTC",t
HABITACIÓN EN LA NAPOLES.-WTC. VIGILANCIA 24hrs,t
Habitación acogedora en increíble ubicación,t
Espacio hermoso en la Roma,t
México Chulo - Apartment 102,t
Céntrica y práctica habitación en Tlatelolco,t
Rooms & LOFT private  para 3 personas,t
México Chulo - Apartment 202,t
Lovely Home,t
Apartment 301 at Paris 10 Apartments,t
Alcoba de lujo con gym a 2 calles de Parque Delta!,t
LOFT para 2 artistas /2 habitaciones  2 baños,t
Bonita habitación cerca de WTC y C.C.Metrópoli,t
GREAT PLACE AND LOCATION AT POLANCO 4,t
Loft cerca aeropuerto terminal 2,t
Depa ideal para parejas en Condesa,t
Cozy Room1 Lomas de Chapultepec,t
"Casa c/jardín para fiestas, eventos, boda, XV CDMX",t
Habitación cómoda cercana a universidades,t
Nuevo y Encantador en LA CONDESA,t
la casa de otto,t
"Habitación individual, hermosa casa en la Condesa",t
ENTIRE APARTMENT CLOSE TO POLANCO,t
Casa México 1,t
Nice apartment,t
LIVE CDMX AS A LOCAL AT MY IMMACULATE HOME!!!,t
"Departamento con 70 M2 de paz, calidez y armonía.",t
Habitación  - Fraccionamiento privado,t
"""DePau"" Modern Mexican Style Apartment in Coyoacán",t
Great new 1 bedroom  apartment in Polanco!,t
Comfortable rooms in south house of the CDMX,t
TRENDY 2BEDROOM APT @VIRREYES-LOMAS DE CHAPULTEPEC,t
Bienvenido a nuestro hogar!,t
"INCREIBLE DEPARTAMENTO, AMPLIO Y COMODO EN CONDESA",t
Hermoso Loft muy cerca del Centro #CDMX,t
"Céntrica habitación enCDMX, con jardín propio.",t
"Polanco bonita hab.privad.c/baño, depa compartido.",t
Bright & Cozy Apartment Loft In Top Location,t
Cozy Apartment In Quite Condesa Area,t
